[
  {
    "title": "Graphic Designer (Volunteer)",
    "organization": "5-Eleven Hoops",
    "location": "Virtual (Virtual)",
    "date": "Ongoing",
    "time": null,
    "duration": null,
    "datetime_iso": "2026-01-28T00:01:00Z",
    "distance": "0 miles",
    "opportunity_type": "Volunteer Opportunity",
    "opportunity_url": "https://volunteer.laworks.com/opportunity/a0CQg0000AvhV7wMQE",
    "opportunity_id": "a0CQg0000AvhV7wMQE",
    "organization_url": "https://volunteer.laworks.com/organization/0013l00002MQHwlAAH",
    "scraped_at": "2026-02-11T17:58:24.250261"
  },
  {
    "title": "Social Media Manager (Volunteer)",
    "organization": "5-Eleven Hoops",
    "location": "Virtual (Virtual)",
    "date": "Ongoing",
    "time": null,
    "duration": null,
    "datetime_iso": "2026-01-28T00:01:00Z",
    "distance": "0 miles",
    "opportunity_type": "Volunteer Opportunity",
    "opportunity_url": "https://volunteer.laworks.com/opportunity/a0CQg0000AviPknMQE",
    "opportunity_id": "a0CQg0000AviPknMQE",
    "organization_url": "https://volunteer.laworks.com/organization/0013l00002MQHwlAAH",
    "scraped_at": "2026-02-11T17:58:24.269415"
  },
  {
    "title": "Fundraiser Volunteer",
    "organization": "5-Eleven Hoops",
    "location": "Virtual (Virtual)",
    "date": "Ongoing",
    "time": null,
    "duration": null,
    "datetime_iso": "2026-01-28T00:01:00Z",
    "distance": "0 miles",
    "opportunity_type": "Volunteer Opportunity",
    "opportunity_url": "https://volunteer.laworks.com/opportunity/a0CQg0000AviajOMQQ",
    "opportunity_id": "a0CQg0000AviajOMQQ",
    "organization_url": "https://volunteer.laworks.com/organization/0013l00002MQHwlAAH",
    "scraped_at": "2026-02-11T17:58:24.286183"
  },
  {
    "title": "Mock Interviewing with Participants (Step into Tech)",
    "organization": "UNITE-LA",
    "location": "Zoom (Virtual)",
    "date": "Ongoing",
    "time": null,
    "duration": null,
    "datetime_iso": "2026-02-05T00:01:00Z",
    "distance": "0 miles",
    "opportunity_type": "Volunteer Opportunity",
    "opportunity_url": "https://volunteer.laworks.com/opportunity/a0CQg0000B2y8f6MQA",
    "opportunity_id": "a0CQg0000B2y8f6MQA",
    "organization_url": "https://volunteer.laworks.com/organization/0013l00002c5ehiAAA",
    "scraped_at": "2026-02-11T17:58:24.304484"
  },
  {
    "title": "Make a Difference, Become a Mentor (Step into Tech)!",
    "organization": "UNITE-LA",
    "location": "Zoom (Virtual)",
    "date": "Ongoing",
    "time": null,
    "duration": null,
    "datetime_iso": "2026-03-10T00:01:00Z",
    "distance": "0 miles",
    "opportunity_type": "Volunteer Opportunity",
    "opportunity_url": "https://volunteer.laworks.com/opportunity/a0CQg0000B2y8TlMQI",
    "opportunity_id": "a0CQg0000B2y8TlMQI",
    "organization_url": "https://volunteer.laworks.com/organization/0013l00002c5ehiAAA",
    "scraped_at": "2026-02-11T17:58:24.325376"
  },
  {
    "title": "ðŸŒŸ Be the Spark: Change a Childâ€™s Future with Just One Hour a Week",
    "organization": "School on Wheels",
    "location": "Various Locations (Virtual)",
    "date": "Ongoing",
    "time": null,
    "duration": null,
    "datetime_iso": "2025-12-31T00:01:00Z",
    "distance": "0 miles",
    "opportunity_type": "Volunteer Opportunity",
    "opportunity_url": "https://volunteer.laworks.com/opportunity/a0CQg0000ALlMr4MQF",
    "opportunity_id": "a0CQg0000ALlMr4MQF",
    "organization_url": "https://volunteer.laworks.com/organization/001A000001FZLFlIAP",
    "scraped_at": "2026-02-11T17:58:24.340632"
  },
  {
    "title": "Networking with Participants (Step into Tech)",
    "organization": "UNITE-LA",
    "location": "Virtual (Virtual)",
    "date": "Ongoing",
    "time": null,
    "duration": null,
    "datetime_iso": "2026-02-05T00:01:00Z",
    "distance": "0 miles",
    "opportunity_type": "Volunteer Opportunity",
    "opportunity_url": "https://volunteer.laworks.com/opportunity/a0CQg0000B2xtf9MQA",
    "opportunity_id": "a0CQg0000B2xtf9MQA",
    "organization_url": "https://volunteer.laworks.com/organization/0013l00002c5ehiAAA",
    "scraped_at": "2026-02-11T17:58:24.362975"
  },
  {
    "title": "Coordinate A Book Drive for Little Free Libraries Near You",
    "organization": "Little Free Library",
    "location": "Anywhere in the LA area where there are Little Free Libraries (Virtual)",
    "date": "Ongoing",
    "time": null,
    "duration": null,
    "datetime_iso": "2024-10-10T00:01:00Z",
    "distance": "0 miles",
    "opportunity_type": "Volunteer Opportunity",
    "opportunity_url": "https://volunteer.laworks.com/opportunity/a0CQg00003lwLQuMAM",
    "opportunity_id": "a0CQg00003lwLQuMAM",
    "organization_url": "https://volunteer.laworks.com/organization/001Qg00000JTvuPIAT",
    "scraped_at": "2026-02-11T17:58:24.381428"
  },
  {
    "title": "Distribute Books to Little Free Libraries Near You",
    "organization": "Little Free Library",
    "location": "Anywhere in the LA area where there are Little Free Libraries (Virtual)",
    "date": "Ongoing",
    "time": null,
    "duration": null,
    "datetime_iso": "2024-10-10T00:01:00Z",
    "distance": "0 miles",
    "opportunity_type": "Volunteer Opportunity",
    "opportunity_url": "https://volunteer.laworks.com/opportunity/a0CQg00003lwE0JMAU",
    "opportunity_id": "a0CQg00003lwE0JMAU",
    "organization_url": "https://volunteer.laworks.com/organization/001Qg00000JTvuPIAT",
    "scraped_at": "2026-02-11T17:58:24.395840"
  },
  {
    "title": "Write a thank you note to a Little Free Library steward",
    "organization": "Little Free Library",
    "location": "Anywhere in the LA area where there are Little Free Libraries (Virtual)",
    "date": "Ongoing",
    "time": null,
    "duration": null,
    "datetime_iso": "2026-01-28T00:01:00Z",
    "distance": "0 miles",
    "opportunity_type": "Volunteer Opportunity",
    "opportunity_url": "https://volunteer.laworks.com/opportunity/a0CQg0000Avg31xMQA",
    "opportunity_id": "a0CQg0000Avg31xMQA",
    "organization_url": "https://volunteer.laworks.com/organization/001Qg00000JTvuPIAT",
    "scraped_at": "2026-02-11T17:58:24.419435"
  },
  {
    "title": "Support Students in Need: Step Up Tutoring Info Session",
    "organization": "Step Up Tutoring",
    "location": "Virtual (Virtual)",
    "date": "2/26/26",
    "time": "12:00 PM",
    "duration": "1 hour",
    "datetime_iso": "2026-02-26T12:00:00Z",
    "distance": "0 miles",
    "opportunity_type": "Volunteer Opportunity",
    "opportunity_url": "https://volunteer.laworks.com/opportunity/a0CQg0000B6rPpBMQU",
    "opportunity_id": "a0CQg0000B6rPpBMQU",
    "organization_url": "https://volunteer.laworks.com/organization/0013l00002HeTSuAAN",
    "scraped_at": "2026-02-11T17:58:24.438415"
  },
  {
    "title": "Building Native Habitat at Rio de Los Angeles State Park: TestPlot focused!",
    "organization": "Los Angeles River State Park Partners",
    "location": "Los Angeles, CA 90065",
    "date": "4/12/26",
    "time": "9:00 AM",
    "duration": "2 hours",
    "datetime_iso": "2026-04-12T09:00:00Z",
    "distance": "1 miles",
    "opportunity_type": "Volunteer Opportunity",
    "opportunity_url": "https://volunteer.laworks.com/opportunity/a0CQg00009zgpg6MAA",
    "opportunity_id": "a0CQg00009zgpg6MAA",
    "organization_url": "https://volunteer.laworks.com/organization/0013l00002exhh5AAA",
    "scraped_at": "2026-02-11T17:58:24.455572"
  },
  {
    "title": "Community Work Day at La Esquinita Garden Park",
    "organization": "MRCA",
    "location": "Los Angeles, CA 90065",
    "date": "2/21/26",
    "time": "9:00 AM",
    "duration": "3 hours",
    "datetime_iso": "2026-02-21T09:00:00Z",
    "distance": "2 miles",
    "opportunity_type": "Volunteer Opportunity",
    "opportunity_url": "https://volunteer.laworks.com/opportunity/a0CQg0000B0Ko4gMQC",
    "opportunity_id": "a0CQg0000B0Ko4gMQC",
    "organization_url": "https://volunteer.laworks.com/organization/001A000000a9afKIAQ",
    "scraped_at": "2026-02-11T17:58:24.471612"
  },
  {
    "title": "Harvest Fruit and Fight Hunger in East Los Angeles!",
    "organization": "Food Forward",
    "location": "Los Angeles, CA 90041",
    "date": "Ongoing",
    "time": null,
    "duration": null,
    "datetime_iso": "2024-02-22T00:01:00Z",
    "distance": "2 miles",
    "opportunity_type": "Special Event",
    "opportunity_url": "https://volunteer.laworks.com/opportunity/a0CQg00001O2JEZMA3",
    "opportunity_id": "a0CQg00001O2JEZMA3",
    "organization_url": "https://volunteer.laworks.com/organization/001A000000ixpvaIAA",
    "scraped_at": "2026-02-11T17:58:24.485922"
  },
  {
    "title": "St. Barnabas Produce Distribution",
    "organization": "St. Barnabas Episcopal Church",
    "location": "Los Angeles, CA 90041",
    "date": "2/12/26",
    "time": "8:00 AM",
    "duration": "2.5 hours",
    "datetime_iso": "2026-02-12T08:00:00Z",
    "distance": "2 miles",
    "opportunity_type": "Volunteer Opportunity",
    "opportunity_url": "https://volunteer.laworks.com/opportunity/a0CQg00009h6XhdMAE",
    "opportunity_id": "a0CQg00009h6XhdMAE",
    "organization_url": "https://volunteer.laworks.com/organization/0013l00002ZYpSAAA1",
    "scraped_at": "2026-02-11T17:58:24.502107"
  },
  {
    "title": "Help the Boys & Girls Club's Food Bank Distribution",
    "organization": "Boys & Girls Club of Los Angeles",
    "location": "Los Angeles, CA 90031",
    "date": "2/12/26",
    "time": "2:30 PM",
    "duration": "3.5 hours",
    "datetime_iso": "2026-02-12T14:30:00Z",
    "distance": "2 miles",
    "opportunity_type": "Volunteer Opportunity",
    "opportunity_url": "https://volunteer.laworks.com/opportunity/a0CQg00009OqDF6MAN",
    "opportunity_id": "a0CQg00009OqDF6MAN",
    "organization_url": "https://volunteer.laworks.com/organization/001A000000a9a2oIAA",
    "scraped_at": "2026-02-11T17:58:24.518180"
  },
  {
    "title": "Fight Food Waste at the Atwater Village Farmers Market on Sundays!",
    "organization": "Food Forward",
    "location": "Los Angeles, CA 90039",
    "date": "Ongoing",
    "time": null,
    "duration": null,
    "datetime_iso": "2024-06-10T00:01:00Z",
    "distance": "2 miles",
    "opportunity_type": "Volunteer Opportunity",
    "opportunity_url": "https://volunteer.laworks.com/opportunity/a0CQg00002Rf8voMAB",
    "opportunity_id": "a0CQg00002Rf8voMAB",
    "organization_url": "https://volunteer.laworks.com/organization/001A000000ixpvaIAA",
    "scraped_at": "2026-02-11T17:58:24.532810"
  },
  {
    "title": "VILLAGE VOLUNTEER DAY THIS VALENTINE'S WEEKEND",
    "organization": "Anawakalmekak",
    "location": "Los Angeles, CA 90042",
    "date": "2/14/26",
    "time": "7:45 AM",
    "duration": "3.75 hours",
    "datetime_iso": "2026-02-14T07:45:00Z",
    "distance": "2 miles",
    "opportunity_type": "Volunteer Opportunity",
    "opportunity_url": "https://volunteer.laworks.com/opportunity/a0CQg0000AuWqRXMQ0",
    "opportunity_id": "a0CQg0000AuWqRXMQ0",
    "organization_url": "https://volunteer.laworks.com/organization/001Qg00000kedHzIAI",
    "scraped_at": "2026-02-11T17:58:24.553934"
  },
  {
    "title": "Food Pantry Distribution- St. Athanasius",
    "organization": "Seeds of Hope",
    "location": "Los Angeles, CA 90026",
    "date": "2/13/26",
    "time": "7:00 AM",
    "duration": "3 hours",
    "datetime_iso": "2026-02-13T07:00:00Z",
    "distance": "3 miles",
    "opportunity_type": "Volunteer Opportunity",
    "opportunity_url": "https://volunteer.laworks.com/opportunity/a0CQg0000B24hxIMQQ",
    "opportunity_id": "a0CQg0000B24hxIMQQ",
    "organization_url": "https://volunteer.laworks.com/organization/0013l00002d3jkZAAQ",
    "scraped_at": "2026-02-11T17:58:24.571994"
  },
  {
    "title": "Barnsdall Art Park Community Green Day",
    "organization": "Barnsdall Art Park Foundation",
    "location": "Los Angeles, CA 90027",
    "date": "3/1/26",
    "time": "9:00 AM",
    "duration": "2 hours",
    "datetime_iso": "2026-03-01T09:00:00Z",
    "distance": "4 miles",
    "opportunity_type": "Volunteer Opportunity",
    "opportunity_url": "https://volunteer.laworks.com/opportunity/a0CQg0000AUniT1MQJ",
    "opportunity_id": "a0CQg0000AUniT1MQJ",
    "organization_url": "https://volunteer.laworks.com/organization/001Qg00000dcH7sIAE",
    "scraped_at": "2026-02-11T17:58:24.588951"
  },
  {
    "title": "Food Run Ride Along",
    "organization": "Serve LA",
    "location": "Los Angeles, CA 90029",
    "date": "Ongoing",
    "time": null,
    "duration": null,
    "datetime_iso": "2026-02-03T00:01:00Z",
    "distance": "4 miles",
    "opportunity_type": "Volunteer Opportunity",
    "opportunity_url": "https://volunteer.laworks.com/opportunity/a0CQg0000AxXYMTMQ4",
    "opportunity_id": "a0CQg0000AxXYMTMQ4",
    "organization_url": "https://volunteer.laworks.com/organization/0013l00002d3rG4AAI",
    "scraped_at": "2026-02-11T17:58:24.603989"
  },
  {
    "title": "Evening Support",
    "organization": "Serve LA",
    "location": "Los Angeles, CA 90029",
    "date": "2/11/26",
    "time": "6:00 PM",
    "duration": "2 hours",
    "datetime_iso": "2026-02-11T18:00:00Z",
    "distance": "4 miles",
    "opportunity_type": "Volunteer Opportunity",
    "opportunity_url": "https://volunteer.laworks.com/opportunity/a0CQg0000AYKveUMQT",
    "opportunity_id": "a0CQg0000AYKveUMQT",
    "organization_url": "https://volunteer.laworks.com/organization/0013l00002d3rG4AAI",
    "scraped_at": "2026-02-11T17:58:24.626988"
  },
  {
    "title": "Community Breakfast Meal Prep & Hosting",
    "organization": "Serve LA",
    "location": "Los Angeles, CA 90029",
    "date": "2/12/26",
    "time": "7:30 AM",
    "duration": "3.5 hours",
    "datetime_iso": "2026-02-12T07:30:00Z",
    "distance": "4 miles",
    "opportunity_type": "Volunteer Opportunity",
    "opportunity_url": "https://volunteer.laworks.com/opportunity/a0CQg0000AYKRNOMQ5",
    "opportunity_id": "a0CQg0000AYKRNOMQ5",
    "organization_url": "https://volunteer.laworks.com/organization/0013l00002d3rG4AAI",
    "scraped_at": "2026-02-11T17:58:24.648960"
  },
  {
    "title": "Community Breakfast Meal Prep",
    "organization": "Serve LA",
    "location": "Los Angeles, CA 90029",
    "date": "2/12/26",
    "time": "7:30 AM",
    "duration": "1.5 hours",
    "datetime_iso": "2026-02-12T07:30:00Z",
    "distance": "4 miles",
    "opportunity_type": "Volunteer Opportunity",
    "opportunity_url": "https://volunteer.laworks.com/opportunity/a0CQg0000AYKYYpMQP",
    "opportunity_id": "a0CQg0000AYKYYpMQP",
    "organization_url": "https://volunteer.laworks.com/organization/0013l00002d3rG4AAI",
    "scraped_at": "2026-02-11T17:58:24.669223"
  },
  {
    "title": "Shower Attendant",
    "organization": "Serve LA",
    "location": "Los Angeles, CA 90029",
    "date": "2/12/26",
    "time": "8:45 AM",
    "duration": "3 hours",
    "datetime_iso": "2026-02-12T08:45:00Z",
    "distance": "4 miles",
    "opportunity_type": "Volunteer Opportunity",
    "opportunity_url": "https://volunteer.laworks.com/opportunity/a0CQg0000AYKxDEMQ1",
    "opportunity_id": "a0CQg0000AYKxDEMQ1",
    "organization_url": "https://volunteer.laworks.com/organization/0013l00002d3rG4AAI",
    "scraped_at": "2026-02-11T17:58:24.690528"
  },
  {
    "title": "Community Breakfast Meal Hosting",
    "organization": "Serve LA",
    "location": "Los Angeles, CA 90029",
    "date": "2/12/26",
    "time": "9:00 AM",
    "duration": "2 hours",
    "datetime_iso": "2026-02-12T09:00:00Z",
    "distance": "4 miles",
    "opportunity_type": "Volunteer Opportunity",
    "opportunity_url": "https://volunteer.laworks.com/opportunity/a0CQg0000AYKYwqMQH",
    "opportunity_id": "a0CQg0000AYKYwqMQH",
    "organization_url": "https://volunteer.laworks.com/organization/0013l00002d3rG4AAI",
    "scraped_at": "2026-02-11T17:58:24.710044"
  },
  {
    "title": "Food Sorter",
    "organization": "Serve LA",
    "location": "Los Angeles, CA 90029",
    "date": "2/12/26",
    "time": "10:30 AM",
    "duration": "2 hours",
    "datetime_iso": "2026-02-12T10:30:00Z",
    "distance": "4 miles",
    "opportunity_type": "Volunteer Opportunity",
    "opportunity_url": "https://volunteer.laworks.com/opportunity/a0CQg0000AxXjp1MQC",
    "opportunity_id": "a0CQg0000AxXjp1MQC",
    "organization_url": "https://volunteer.laworks.com/organization/0013l00002d3rG4AAI",
    "scraped_at": "2026-02-11T17:58:24.726786"
  },
  {
    "title": "Community Meals: Mid-Day Support",
    "organization": "Serve LA",
    "location": "Los Angeles, CA 90029",
    "date": "2/12/26",
    "time": "12:00 PM",
    "duration": "3 hours",
    "datetime_iso": "2026-02-12T12:00:00Z",
    "distance": "4 miles",
    "opportunity_type": "Volunteer Opportunity",
    "opportunity_url": "https://volunteer.laworks.com/opportunity/a0CQg0000AYKx20MQD",
    "opportunity_id": "a0CQg0000AYKx20MQD",
    "organization_url": "https://volunteer.laworks.com/organization/0013l00002d3rG4AAI",
    "scraped_at": "2026-02-11T17:58:24.745131"
  },
  {
    "title": "Community Dinner Meal Prep 1",
    "organization": "Serve LA",
    "location": "Los Angeles, CA 90029",
    "date": "2/12/26",
    "time": "1:00 PM",
    "duration": "2 hours",
    "datetime_iso": "2026-02-12T13:00:00Z",
    "distance": "4 miles",
    "opportunity_type": "Volunteer Opportunity",
    "opportunity_url": "https://volunteer.laworks.com/opportunity/a0CQg0000AYKar5MQD",
    "opportunity_id": "a0CQg0000AYKar5MQD",
    "organization_url": "https://volunteer.laworks.com/organization/0013l00002d3rG4AAI",
    "scraped_at": "2026-02-11T17:58:24.762119"
  },
  {
    "title": "Community Dinner Meal Prep 2",
    "organization": "Serve LA",
    "location": "Los Angeles, CA 90029",
    "date": "2/12/26",
    "time": "2:30 PM",
    "duration": "2 hours",
    "datetime_iso": "2026-02-12T14:30:00Z",
    "distance": "4 miles",
    "opportunity_type": "Volunteer Opportunity",
    "opportunity_url": "https://volunteer.laworks.com/opportunity/a0CQg0000AYKsn7MQD",
    "opportunity_id": "a0CQg0000AYKsn7MQD",
    "organization_url": "https://volunteer.laworks.com/organization/0013l00002d3rG4AAI",
    "scraped_at": "2026-02-11T17:58:24.777658"
  },
  {
    "title": "Community Dinner Meal Hosting",
    "organization": "Serve LA",
    "location": "Los Angeles, CA 90029",
    "date": "2/12/26",
    "time": "4:00 PM",
    "duration": "2 hours",
    "datetime_iso": "2026-02-12T16:00:00Z",
    "distance": "4 miles",
    "opportunity_type": "Volunteer Opportunity",
    "opportunity_url": "https://volunteer.laworks.com/opportunity/a0CQg0000AYKeSTMQ1",
    "opportunity_id": "a0CQg0000AYKeSTMQ1",
    "organization_url": "https://volunteer.laworks.com/organization/0013l00002d3rG4AAI",
    "scraped_at": "2026-02-11T17:58:24.796134"
  },
  {
    "title": "Community Dinner Meal Hosting + Evening Support",
    "organization": "Serve LA",
    "location": "Los Angeles, CA 90029",
    "date": "2/12/26",
    "time": "4:00 PM",
    "duration": "4 hours",
    "datetime_iso": "2026-02-12T16:00:00Z",
    "distance": "4 miles",
    "opportunity_type": "Volunteer Opportunity",
    "opportunity_url": "https://volunteer.laworks.com/opportunity/a0CQg0000AYKKfEMQX",
    "opportunity_id": "a0CQg0000AYKKfEMQX",
    "organization_url": "https://volunteer.laworks.com/organization/0013l00002d3rG4AAI",
    "scraped_at": "2026-02-11T17:58:24.812258"
  },
  {
    "title": "Blanket & Cold Weather Clothing Drive - Give the Gift of Warmth",
    "organization": "PATH",
    "location": "Los Angeles, CA 90004",
    "date": "Ongoing",
    "time": null,
    "duration": null,
    "datetime_iso": "2022-10-04T00:01:00Z",
    "distance": "4 miles",
    "opportunity_type": "Special Event",
    "opportunity_url": "https://volunteer.laworks.com/opportunity/a0C3l00000r5N9yEAE",
    "opportunity_id": "a0C3l00000r5N9yEAE",
    "organization_url": "https://volunteer.laworks.com/organization/0013l0000216i40AAA",
    "scraped_at": "2026-02-11T17:58:24.825632"
  },
  {
    "title": "Inspire and Build Students' Career Skills",
    "organization": "Youth Business Alliance",
    "location": "Los Angeles, CA 90004",
    "date": "3/12/26",
    "time": "8:30 AM",
    "duration": "3.6 hours",
    "datetime_iso": "2026-03-12T08:30:00Z",
    "distance": "4 miles",
    "opportunity_type": "Volunteer Opportunity",
    "opportunity_url": "https://volunteer.laworks.com/opportunity/a0CQg0000B0L2qnMQC",
    "opportunity_id": "a0CQg0000B0L2qnMQC",
    "organization_url": "https://volunteer.laworks.com/organization/001Qg00000htSe1IAE",
    "scraped_at": "2026-02-11T17:58:24.843100"
  },
  {
    "title": "Inspire and Build Students' Career Skills: Mock Interviews",
    "organization": "Youth Business Alliance",
    "location": "Los Angeles, CA 90004",
    "date": "3/13/26",
    "time": "8:30 AM",
    "duration": "3.6 hours",
    "datetime_iso": "2026-03-13T08:30:00Z",
    "distance": "4 miles",
    "opportunity_type": "Already Filled",
    "opportunity_url": "https://volunteer.laworks.com/opportunity/a0CQg0000B0LBcpMQG",
    "opportunity_id": "a0CQg0000B0LBcpMQG",
    "organization_url": "https://volunteer.laworks.com/organization/001Qg00000htSe1IAE",
    "scraped_at": "2026-02-11T17:58:24.859061"
  },
  {
    "title": "Counselor Advocate Training Winter 2026",
    "organization": "Peace Over Violence",
    "location": "Los Angeles, CA 90017",
    "date": "2/14/26",
    "time": "9:00 AM",
    "duration": "8 hours",
    "datetime_iso": "2026-02-14T09:00:00Z",
    "distance": "5 miles",
    "opportunity_type": "Volunteer Opportunity",
    "opportunity_url": "https://volunteer.laworks.com/opportunity/a0CQg00009SRb2mMAD",
    "opportunity_id": "a0CQg00009SRb2mMAD",
    "organization_url": "https://volunteer.laworks.com/organization/001A000000a9afJIAQ",
    "scraped_at": "2026-02-11T17:58:24.875897"
  },
  {
    "title": "Event Day Volunteer at Fight For Air Climb Los Angeles",
    "organization": "American Lung Association Los Angeles",
    "location": "Los Angeles, CA 90017",
    "date": "2/22/26",
    "time": "6:30 AM",
    "duration": "7 hours",
    "datetime_iso": "2026-02-22T06:30:00Z",
    "distance": "5 miles",
    "opportunity_type": "Volunteer Opportunity",
    "opportunity_url": "https://volunteer.laworks.com/opportunity/a0CQg0000AAuZZjMQN",
    "opportunity_id": "a0CQg0000AAuZZjMQN",
    "organization_url": "https://volunteer.laworks.com/organization/001Qg0000045cGsIAI",
    "scraped_at": "2026-02-11T17:58:24.892421"
  },
  {
    "title": "Heart of Los Angeles: Scholarship Mentor Program 2026",
    "organization": "Heart of Los Angeles (HOLA)",
    "location": "Los Angeles, CA 90057",
    "date": "2/18/26",
    "time": "6:00 PM",
    "duration": "1.25 hours",
    "datetime_iso": "2026-02-18T18:00:00Z",
    "distance": "5 miles",
    "opportunity_type": "Volunteer Opportunity",
    "opportunity_url": "https://volunteer.laworks.com/opportunity/a0CQg0000AVhromMQB",
    "opportunity_id": "a0CQg0000AVhromMQB",
    "organization_url": "https://volunteer.laworks.com/organization/001A000000a9aOjIAI",
    "scraped_at": "2026-02-11T17:58:24.908027"
  },
  {
    "title": "ðŸŒŸ Bring Hope to Skid Rowâ€”Volunteer After School! ðŸŒŸ",
    "organization": "School on Wheels",
    "location": "Los Angeles, CA 90021",
    "date": "Ongoing",
    "time": null,
    "duration": null,
    "datetime_iso": "2025-12-31T00:01:00Z",
    "distance": "5 miles",
    "opportunity_type": "Volunteer Opportunity",
    "opportunity_url": "https://volunteer.laworks.com/opportunity/a0CQg0000ALlYpvMQF",
    "opportunity_id": "a0CQg0000ALlYpvMQF",
    "organization_url": "https://volunteer.laworks.com/organization/001A000001FZLFlIAP",
    "scraped_at": "2026-02-11T17:58:24.920999"
  },
  {
    "title": "Fountain Community Garden Volunteer Day",
    "organization": "Fountain Community Gardens",
    "location": "Los Angeles, CA 90028",
    "date": "2/14/26",
    "time": "10:00 AM",
    "duration": "2 hours",
    "datetime_iso": "2026-02-14T10:00:00Z",
    "distance": "5 miles",
    "opportunity_type": "Volunteer Opportunity",
    "opportunity_url": "https://volunteer.laworks.com/opportunity/a0CQg0000ATr4cRMQR",
    "opportunity_id": "a0CQg0000ATr4cRMQR",
    "organization_url": "https://volunteer.laworks.com/organization/001Qg000001tpuCIAQ",
    "scraped_at": "2026-02-11T17:58:24.936468"
  },
  {
    "title": "Spring Day Camp Volunteers",
    "organization": "The Salvation Army",
    "location": "Los Angeles, CA 90015",
    "date": "3/30/26",
    "time": "8:30 AM",
    "duration": "5.5 hours",
    "datetime_iso": "2026-03-30T08:30:00Z",
    "distance": "5 miles",
    "opportunity_type": "Volunteer Opportunity",
    "opportunity_url": "https://volunteer.laworks.com/opportunity/a0CQg0000B2xZcUMQU",
    "opportunity_id": "a0CQg0000B2xZcUMQU",
    "organization_url": "https://volunteer.laworks.com/organization/001A000001B975lIAB",
    "scraped_at": "2026-02-11T17:58:24.953491"
  },
  {
    "title": "Drive cancer patients to and from treatment - Volunteer Driver Road To Recovery",
    "organization": "American Cancer Society Los Angeles Region",
    "location": "Los Angeles, CA 90010",
    "date": "Ongoing",
    "time": null,
    "duration": null,
    "datetime_iso": "2026-02-02T00:01:00Z",
    "distance": "5 miles",
    "opportunity_type": "Volunteer Opportunity",
    "opportunity_url": "https://volunteer.laworks.com/opportunity/a0CQg0000B0MVSaMQO",
    "opportunity_id": "a0CQg0000B0MVSaMQO",
    "organization_url": "https://volunteer.laworks.com/organization/001A000000a9a5rIAA",
    "scraped_at": "2026-02-11T17:58:24.966263"
  },
  {
    "title": "Meal Provider Volunteer",
    "organization": "Safe Parking LA - A project of Community Partners",
    "location": "Los Angeles, CA 90025",
    "date": "Ongoing",
    "time": null,
    "duration": null,
    "datetime_iso": "2026-01-05T00:01:00Z",
    "distance": "5 miles",
    "opportunity_type": "Volunteer Opportunity",
    "opportunity_url": "https://volunteer.laworks.com/opportunity/a0CQg0000AP3nX0MQJ",
    "opportunity_id": "a0CQg0000AP3nX0MQJ",
    "organization_url": "https://volunteer.laworks.com/organization/0013l00002ZZMj0AAH",
    "scraped_at": "2026-02-11T17:58:24.979406"
  },
  {
    "title": "Lot Host Volunteer",
    "organization": "Safe Parking LA - A project of Community Partners",
    "location": "Los Angeles, CA 90025",
    "date": "Ongoing",
    "time": null,
    "duration": null,
    "datetime_iso": "2026-01-05T00:01:00Z",
    "distance": "5 miles",
    "opportunity_type": "Volunteer Opportunity",
    "opportunity_url": "https://volunteer.laworks.com/opportunity/a0CQg0000ARwJFMMQ3",
    "opportunity_id": "a0CQg0000ARwJFMMQ3",
    "organization_url": "https://volunteer.laworks.com/organization/0013l00002ZZMj0AAH",
    "scraped_at": "2026-02-11T17:58:24.992047"
  },
  {
    "title": "Events Volunteer for Safe Parking LA",
    "organization": "Safe Parking LA - A project of Community Partners",
    "location": "Los Angeles, CA 90025",
    "date": "2/13/26",
    "time": "8:00 AM",
    "duration": "14 hours",
    "datetime_iso": "2026-02-13T08:00:00Z",
    "distance": "5 miles",
    "opportunity_type": "Volunteer Opportunity",
    "opportunity_url": "https://volunteer.laworks.com/opportunity/a0CQg00008gHkqJMAS",
    "opportunity_id": "a0CQg00008gHkqJMAS",
    "organization_url": "https://volunteer.laworks.com/organization/0013l00002ZZMj0AAH",
    "scraped_at": "2026-02-11T17:58:25.006961"
  },
  {
    "title": "Fight Food Waste at the Social District (DTLA) Farmers Market on Saturdays!",
    "organization": "Food Forward",
    "location": "Los Angeles, CA 90015",
    "date": "Ongoing",
    "time": null,
    "duration": null,
    "datetime_iso": "2025-09-29T00:01:00Z",
    "distance": "5 miles",
    "opportunity_type": "Volunteer Opportunity",
    "opportunity_url": "https://volunteer.laworks.com/opportunity/a0CQg000093L7OQMA0",
    "opportunity_id": "a0CQg000093L7OQMA0",
    "organization_url": "https://volunteer.laworks.com/organization/001A000000ixpvaIAA",
    "scraped_at": "2026-02-11T17:58:25.058963"
  },
  {
    "title": "American Red Cross - Disaster Action Team- South LA, West LA, DTLA, Koreatown,",
    "organization": "American Red Cross Los Angeles Region",
    "location": "Los Angeles, CA 90021",
    "date": "Ongoing",
    "time": null,
    "duration": null,
    "datetime_iso": "2022-08-16T00:01:00Z",
    "distance": "5 miles",
    "opportunity_type": "Already Filled",
    "opportunity_url": "https://volunteer.laworks.com/opportunity/a0C3l00000r4dsPEAQ",
    "opportunity_id": "a0C3l00000r4dsPEAQ",
    "organization_url": "https://volunteer.laworks.com/organization/001A000000a9b0aIAA",
    "scraped_at": "2026-02-11T17:58:25.086000"
  },
  {
    "title": "American Red Cross: Disaster Recovery - Glendale * Pomona * San Gabriel Valley",
    "organization": "American Red Cross Los Angeles Region",
    "location": "Los Angeles, CA 90021",
    "date": "Ongoing",
    "time": null,
    "duration": null,
    "datetime_iso": "2022-09-14T00:01:00Z",
    "distance": "5 miles",
    "opportunity_type": "Volunteer Opportunity",
    "opportunity_url": "https://volunteer.laworks.com/opportunity/a0C3l00000r52RCEAY",
    "opportunity_id": "a0C3l00000r52RCEAY",
    "organization_url": "https://volunteer.laworks.com/organization/001A000000a9b0aIAA",
    "scraped_at": "2026-02-11T17:58:25.105367"
  },
  {
    "title": "American Red Cross: Service to the armed Forces Presenters",
    "organization": "American Red Cross Los Angeles Region",
    "location": "Los Angeles, CA 90021",
    "date": "Ongoing",
    "time": null,
    "duration": null,
    "datetime_iso": "2023-10-26T00:01:00Z",
    "distance": "5 miles",
    "opportunity_type": "Volunteer Opportunity",
    "opportunity_url": "https://volunteer.laworks.com/opportunity/a0CQg00000FPqcjMAD",
    "opportunity_id": "a0CQg00000FPqcjMAD",
    "organization_url": "https://volunteer.laworks.com/organization/001A000000a9b0aIAA",
    "scraped_at": "2026-02-11T17:58:25.122080"
  },
  {
    "title": "Red Cross: Service to the Armed Forces Presenter - Metro Southeast LA",
    "organization": "American Red Cross Los Angeles Region",
    "location": "Los Angeles, CA 90021",
    "date": "Ongoing",
    "time": null,
    "duration": null,
    "datetime_iso": "2023-12-20T00:01:00Z",
    "distance": "5 miles",
    "opportunity_type": "Volunteer Opportunity",
    "opportunity_url": "https://volunteer.laworks.com/opportunity/a0CQg00000moSIkMAM",
    "opportunity_id": "a0CQg00000moSIkMAM",
    "organization_url": "https://volunteer.laworks.com/organization/001A000000a9b0aIAA",
    "scraped_at": "2026-02-11T17:58:25.135648"
  },
  {
    "title": "International Services Restoring Family Links Program Volunteer Comm, Outreach",
    "organization": "American Red Cross Los Angeles Region",
    "location": "Los Angeles, CA 90021",
    "date": "Ongoing",
    "time": null,
    "duration": null,
    "datetime_iso": "2024-01-01T00:01:00Z",
    "distance": "5 miles",
    "opportunity_type": "Volunteer Opportunity",
    "opportunity_url": "https://volunteer.laworks.com/opportunity/a0CQg000019MWOXMA4",
    "opportunity_id": "a0CQg000019MWOXMA4",
    "organization_url": "https://volunteer.laworks.com/organization/001A000000a9b0aIAA",
    "scraped_at": "2026-02-11T17:58:25.148831"
  },
  {
    "title": "Red Cross - Home Fire Campaign Team Member",
    "organization": "American Red Cross Los Angeles Region",
    "location": "Los Angeles, CA 90021",
    "date": "Ongoing",
    "time": null,
    "duration": null,
    "datetime_iso": "2025-09-17T00:01:00Z",
    "distance": "5 miles",
    "opportunity_type": "Volunteer Opportunity",
    "opportunity_url": "https://volunteer.laworks.com/opportunity/a0CQg00008skW1hMAE",
    "opportunity_id": "a0CQg00008skW1hMAE",
    "organization_url": "https://volunteer.laworks.com/organization/001A000000a9b0aIAA",
    "scraped_at": "2026-02-11T17:58:25.162727"
  },
  {
    "title": "YMCA Boyle Heights Food Distribution Support",
    "organization": "YMCA Weingart East Los Angeles",
    "location": "Los Angeles, CA 90023",
    "date": "2/16/26",
    "time": "8:30 AM",
    "duration": "3.5 hours",
    "datetime_iso": "2026-02-16T08:30:00Z",
    "distance": "5 miles",
    "opportunity_type": "Volunteer Opportunity",
    "opportunity_url": "https://volunteer.laworks.com/opportunity/a0CQg00007OUMzjMAH",
    "opportunity_id": "a0CQg00007OUMzjMAH",
    "organization_url": "https://volunteer.laworks.com/organization/001A000000a9aoJIAQ",
    "scraped_at": "2026-02-11T17:58:25.178483"
  },
  {
    "title": "SAINT STEPHEN'S PRODUCE DISTRIBUTION",
    "organization": "St. Stephens Episcopal Church",
    "location": "Los Angeles, CA 90028",
    "date": "2/18/26",
    "time": "8:30 AM",
    "duration": "2.5 hours",
    "datetime_iso": "2026-02-18T08:30:00Z",
    "distance": "6 miles",
    "opportunity_type": "Volunteer Opportunity",
    "opportunity_url": "https://volunteer.laworks.com/opportunity/a0CQg00009h6mLVMAY",
    "opportunity_id": "a0CQg00009h6mLVMAY",
    "organization_url": "https://volunteer.laworks.com/organization/0013l00002c4iYKAAY",
    "scraped_at": "2026-02-11T17:58:25.194198"
  },
  {
    "title": "Support Red Cross Blood Drives - Volunteer! (Los Angeles)",
    "organization": "American Red Cross Los Angeles Region",
    "location": "Los Angeles, CA 90021",
    "date": "Ongoing",
    "time": null,
    "duration": null,
    "datetime_iso": "2024-01-04T00:01:00Z",
    "distance": "6 miles",
    "opportunity_type": "Volunteer Opportunity",
    "opportunity_url": "https://volunteer.laworks.com/opportunity/a0CQg00000u5Q6kMAE",
    "opportunity_id": "a0CQg00000u5Q6kMAE",
    "organization_url": "https://volunteer.laworks.com/organization/001A000000a9b0aIAA",
    "scraped_at": "2026-02-11T17:58:25.209161"
  },
  {
    "title": "LEND A HAND: Provide Support to Transitional Families",
    "organization": "Alexandria House",
    "location": "Los Angeles, CA 90020",
    "date": "3/15/26",
    "time": "10:00 AM",
    "duration": "3 hours",
    "datetime_iso": "2026-03-15T10:00:00Z",
    "distance": "6 miles",
    "opportunity_type": "Volunteer Opportunity",
    "opportunity_url": "https://volunteer.laworks.com/opportunity/a0CQg00009Z8TdkMAF",
    "opportunity_id": "a0CQg00009Z8TdkMAF",
    "organization_url": "https://volunteer.laworks.com/organization/001A000000a9aOvIAI",
    "scraped_at": "2026-02-11T17:58:25.225185"
  },
  {
    "title": "Pantry Program - Help Distribute Food To Those In Need!",
    "organization": "St. Francis Center",
    "location": "Los Angeles, CA 90015",
    "date": "2/12/26",
    "time": "9:00 AM",
    "duration": "3 hours",
    "datetime_iso": "2026-02-12T09:00:00Z",
    "distance": "6 miles",
    "opportunity_type": "Special Event",
    "opportunity_url": "https://volunteer.laworks.com/opportunity/a0CQg0000ArGqezMQC",
    "opportunity_id": "a0CQg0000ArGqezMQC",
    "organization_url": "https://volunteer.laworks.com/organization/001A000000a9a5ZIAQ",
    "scraped_at": "2026-02-11T17:58:25.241084"
  },
  {
    "title": "Breakfast - Help Prepare & Distribute Breakfast to our Unhoused Community",
    "organization": "St. Francis Center",
    "location": "Los Angeles, CA 90015",
    "date": "2/13/26",
    "time": "7:00 AM",
    "duration": "1.5 hours",
    "datetime_iso": "2026-02-13T07:00:00Z",
    "distance": "6 miles",
    "opportunity_type": "Volunteer Opportunity",
    "opportunity_url": "https://volunteer.laworks.com/opportunity/a0CQg0000ArGYMaMQO",
    "opportunity_id": "a0CQg0000ArGYMaMQO",
    "organization_url": "https://volunteer.laworks.com/organization/001A000000a9a5ZIAQ",
    "scraped_at": "2026-02-11T17:58:25.256588"
  },
  {
    "title": "Fight Food Waste at the Hollywood Farmers Market on Sundays!",
    "organization": "Food Forward",
    "location": "Los Angeles, CA 90028",
    "date": "Ongoing",
    "time": null,
    "duration": null,
    "datetime_iso": "2022-03-30T00:01:00Z",
    "distance": "6 miles",
    "opportunity_type": "Volunteer Opportunity",
    "opportunity_url": "https://volunteer.laworks.com/opportunity/a0C3l00000ojWwhEAE",
    "opportunity_id": "a0C3l00000ojWwhEAE",
    "organization_url": "https://volunteer.laworks.com/organization/001A000000ixpvaIAA",
    "scraped_at": "2026-02-11T17:58:25.269967"
  },
  {
    "title": "Restore an Altadena School Garden for Youth Eaton Fire Survivors",
    "organization": "John Muir High School Early College Magnet",
    "location": "Pasadena, CA 91103",
    "date": "2/28/26",
    "time": "9:00 AM",
    "duration": "3 hours",
    "datetime_iso": "2026-02-28T09:00:00Z",
    "distance": "6 miles",
    "opportunity_type": "Special Event",
    "opportunity_url": "https://volunteer.laworks.com/opportunity/a0CQg0000A8htm9MQA",
    "opportunity_id": "a0CQg0000A8htm9MQA",
    "organization_url": "https://volunteer.laworks.com/organization/001Qg000004mTiIIAU",
    "scraped_at": "2026-02-11T17:58:25.287467"
  },
  {
    "title": "Food Pantry - Help Distribute Produce to community members in South Central",
    "organization": "Universal Community Health Center",
    "location": "Los Angeles, CA 90011",
    "date": "2/14/26",
    "time": "7:30 AM",
    "duration": "3.25 hours",
    "datetime_iso": "2026-02-14T07:30:00Z",
    "distance": "6 miles",
    "opportunity_type": "Volunteer Opportunity",
    "opportunity_url": "https://volunteer.laworks.com/opportunity/a0CQg0000AYLdYjMQL",
    "opportunity_id": "a0CQg0000AYLdYjMQL",
    "organization_url": "https://volunteer.laworks.com/organization/001Qg00000HSVNKIA5",
    "scraped_at": "2026-02-11T17:58:25.304876"
  },
  {
    "title": "Read Aloud to Children Each Month",
    "organization": "Reading to Kids",
    "location": "Los Angeles, CA 90006",
    "date": "2/14/26",
    "time": "9:00 AM",
    "duration": "3 hours",
    "datetime_iso": "2026-02-14T09:00:00Z",
    "distance": "6 miles",
    "opportunity_type": "Volunteer Opportunity",
    "opportunity_url": "https://volunteer.laworks.com/opportunity/a0CQg00004hDq3FMAS",
    "opportunity_id": "a0CQg00004hDq3FMAS",
    "organization_url": "https://volunteer.laworks.com/organization/001A000000a9ZzUIAU",
    "scraped_at": "2026-02-11T17:58:25.320034"
  },
  {
    "title": "Staff A Free Store for Eaton Fire Survivors",
    "organization": "Eaton Fire Collaborative",
    "location": "Altadena, CA 91001",
    "date": "2/12/26",
    "time": "9:00 AM",
    "duration": "5 hours",
    "datetime_iso": "2026-02-12T09:00:00Z",
    "distance": "6 miles",
    "opportunity_type": "Special Event",
    "opportunity_url": "https://volunteer.laworks.com/opportunity/a0CQg0000ACZgoaMQD",
    "opportunity_id": "a0CQg0000ACZgoaMQD",
    "organization_url": "https://volunteer.laworks.com/organization/001Qg00000eashCIAQ",
    "scraped_at": "2026-02-11T17:58:25.335648"
  },
  {
    "title": "Restock A Free Store for Eaton Fire Survivors",
    "organization": "Eaton Fire Collaborative",
    "location": "Altadena, CA 91001",
    "date": "2/18/26",
    "time": "10:00 AM",
    "duration": "6 hours",
    "datetime_iso": "2026-02-18T10:00:00Z",
    "distance": "6 miles",
    "opportunity_type": "Special Event",
    "opportunity_url": "https://volunteer.laworks.com/opportunity/a0CQg0000ACYDzMMQX",
    "opportunity_id": "a0CQg0000ACYDzMMQX",
    "organization_url": "https://volunteer.laworks.com/organization/001Qg00000eashCIAQ",
    "scraped_at": "2026-02-11T17:58:25.351199"
  },
  {
    "title": "Pack Groceries and Home/Hygiene Essentials for Families in Need in South Central",
    "organization": "A Place Called Home",
    "location": "Los Angeles, CA 90011",
    "date": "2/26/26",
    "time": "9:30 AM",
    "duration": "2.5 hours",
    "datetime_iso": "2026-02-26T09:30:00Z",
    "distance": "7 miles",
    "opportunity_type": "Volunteer Opportunity",
    "opportunity_url": "https://volunteer.laworks.com/opportunity/a0CQg0000ApxhJRMQY",
    "opportunity_id": "a0CQg0000ApxhJRMQY",
    "organization_url": "https://volunteer.laworks.com/organization/001A000000a9a74IAA",
    "scraped_at": "2026-02-11T17:58:25.366160"
  },
  {
    "title": "Volunteer with our Food Pantry Program",
    "organization": "First AME Church",
    "location": "Los Angeles, CA 90018",
    "date": "3/28/26",
    "time": "7:00 AM",
    "duration": "5 hours",
    "datetime_iso": "2026-03-28T07:00:00Z",
    "distance": "7 miles",
    "opportunity_type": "Volunteer Opportunity",
    "opportunity_url": "https://volunteer.laworks.com/opportunity/a0CQg0000ADObHPMQ1",
    "opportunity_id": "a0CQg0000ADObHPMQ1",
    "organization_url": "https://volunteer.laworks.com/organization/001A000001EbnH8IAJ",
    "scraped_at": "2026-02-11T17:58:25.381278"
  },
  {
    "title": "Inspire and Build Students' Career Skills",
    "organization": "Youth Business Alliance",
    "location": "Los Angeles, CA 90007",
    "date": "3/5/26",
    "time": "1:50 PM",
    "duration": "1.67 hours",
    "datetime_iso": "2026-03-05T13:50:00Z",
    "distance": "7 miles",
    "opportunity_type": "Volunteer Opportunity",
    "opportunity_url": "https://volunteer.laworks.com/opportunity/a0CQg0000B7xPNQMQ2",
    "opportunity_id": "a0CQg0000B7xPNQMQ2",
    "organization_url": "https://volunteer.laworks.com/organization/001Qg00000htSe1IAE",
    "scraped_at": "2026-02-11T17:58:25.396605"
  },
  {
    "title": "Food Pantry Distribution-Plummer Park",
    "organization": "Seeds of Hope",
    "location": "Los Angeles, CA 90046",
    "date": "2/17/26",
    "time": "9:30 AM",
    "duration": "2.5 hours",
    "datetime_iso": "2026-02-17T09:30:00Z",
    "distance": "7 miles",
    "opportunity_type": "Volunteer Opportunity",
    "opportunity_url": "https://volunteer.laworks.com/opportunity/a0CQg0000B2yRWSMQ2",
    "opportunity_id": "a0CQg0000B2yRWSMQ2",
    "organization_url": "https://volunteer.laworks.com/organization/0013l00002d3jkZAAQ",
    "scraped_at": "2026-02-11T17:58:25.413586"
  },
  {
    "title": "Volunteers Needed at Tail Town Cats!",
    "organization": "Tail Town Cats",
    "location": "Pasadena, CA 91104",
    "date": "Ongoing",
    "time": null,
    "duration": null,
    "datetime_iso": "2025-07-19T00:01:00Z",
    "distance": "8 miles",
    "opportunity_type": "Volunteer Opportunity",
    "opportunity_url": "https://volunteer.laworks.com/opportunity/a0CQg00007zxB1tMAE",
    "opportunity_id": "a0CQg00007zxB1tMAE",
    "organization_url": "https://volunteer.laworks.com/organization/001Qg00000YJqdhIAD",
    "scraped_at": "2026-02-11T17:58:25.431597"
  },
  {
    "title": "Volunteer Promoter for Tail Town Cats",
    "organization": "Tail Town Cats",
    "location": "Pasadena, CA 91104",
    "date": "Ongoing",
    "time": null,
    "duration": null,
    "datetime_iso": "2025-12-09T00:01:00Z",
    "distance": "8 miles",
    "opportunity_type": "Volunteer Opportunity",
    "opportunity_url": "https://volunteer.laworks.com/opportunity/a0CQg0000A3pn1RMQQ",
    "opportunity_id": "a0CQg0000A3pn1RMQQ",
    "organization_url": "https://volunteer.laworks.com/organization/001Qg00000YJqdhIAD",
    "scraped_at": "2026-02-11T17:58:25.450558"
  },
  {
    "title": "Construction Volunteering in Altadenaâ€”No Experience Needed",
    "organization": "Habitat for Humanity San Gabriel Valley",
    "location": "Altadena, CA 91001",
    "date": "2/18/26",
    "time": "7:45 AM",
    "duration": "7.75 hours",
    "datetime_iso": "2026-02-18T07:45:00Z",
    "distance": "8 miles",
    "opportunity_type": "Special Event",
    "opportunity_url": "https://volunteer.laworks.com/opportunity/a0CQg0000B2wN38MQE",
    "opportunity_id": "a0CQg0000B2wN38MQE",
    "organization_url": "https://volunteer.laworks.com/organization/001A000001AcvLIIAZ",
    "scraped_at": "2026-02-11T17:58:25.473749"
  },
  {
    "title": "Support Red Cross Fixed Site Blood Drives - Volunteer! (Burbank, CA)",
    "organization": "American Red Cross Los Angeles Region",
    "location": "Burbank, CA 91505",
    "date": "Ongoing",
    "time": null,
    "duration": null,
    "datetime_iso": "2022-12-28T00:01:00Z",
    "distance": "8 miles",
    "opportunity_type": "Volunteer Opportunity",
    "opportunity_url": "https://volunteer.laworks.com/opportunity/a0C3l00000r6hSPEAY",
    "opportunity_id": "a0C3l00000r6hSPEAY",
    "organization_url": "https://volunteer.laworks.com/organization/001A000000a9b0aIAA",
    "scraped_at": "2026-02-11T17:58:25.491911"
  },
  {
    "title": "Fight Food Waste at the West Hollywood Farmers Market on Mondays!",
    "organization": "Food Forward",
    "location": "West Hollywood, CA 90046",
    "date": "Ongoing",
    "time": null,
    "duration": null,
    "datetime_iso": "2024-02-26T00:01:00Z",
    "distance": "8 miles",
    "opportunity_type": "Volunteer Opportunity",
    "opportunity_url": "https://volunteer.laworks.com/opportunity/a0CQg00001A2CZlMAN",
    "opportunity_id": "a0CQg00001A2CZlMAN",
    "organization_url": "https://volunteer.laworks.com/organization/001A000000ixpvaIAA",
    "scraped_at": "2026-02-11T17:58:25.507797"
  },
  {
    "title": "Harvest Fruit and Fight Hunger in San Gabriel Valley!",
    "organization": "Food Forward",
    "location": "San Gabriel, CA 91775",
    "date": "Ongoing",
    "time": null,
    "duration": null,
    "datetime_iso": "2024-05-29T00:01:00Z",
    "distance": "8 miles",
    "opportunity_type": "Volunteer Opportunity",
    "opportunity_url": "https://volunteer.laworks.com/opportunity/a0CQg00002KEhWnMAL",
    "opportunity_id": "a0CQg00002KEhWnMAL",
    "organization_url": "https://volunteer.laworks.com/organization/001A000000ixpvaIAA",
    "scraped_at": "2026-02-11T17:58:25.532255"
  },
  {
    "title": "Kids Club Volunteer â€“ Homework Help & Enrichment",
    "organization": "Retirement Housing Foundation",
    "location": "Los Angeles, CA 90037",
    "date": "Ongoing",
    "time": null,
    "duration": null,
    "datetime_iso": "2026-02-10T00:01:00Z",
    "distance": "8 miles",
    "opportunity_type": "Volunteer Opportunity",
    "opportunity_url": "https://volunteer.laworks.com/opportunity/a0CQg0000AYIsEAMQ1",
    "opportunity_id": "a0CQg0000AYIsEAMQ1",
    "organization_url": "https://volunteer.laworks.com/organization/001Qg00000jFra0IAC",
    "scraped_at": "2026-02-11T17:58:25.548623"
  },
  {
    "title": "Bingo Instructor for Senior Community",
    "organization": "Retirement Housing Foundation",
    "location": "Los Angeles, CA 90037",
    "date": "2/18/26",
    "time": "2:00 PM",
    "duration": "1 hour",
    "datetime_iso": "2026-02-18T14:00:00Z",
    "distance": "8 miles",
    "opportunity_type": "Volunteer Opportunity",
    "opportunity_url": "https://volunteer.laworks.com/opportunity/a0CQg0000AJ9c0ZMQR",
    "opportunity_id": "a0CQg0000AJ9c0ZMQR",
    "organization_url": "https://volunteer.laworks.com/organization/001Qg00000jFra0IAC",
    "scraped_at": "2026-02-11T17:58:25.565573"
  },
  {
    "title": "Bingo Instructor for Senior Community",
    "organization": "Retirement Housing Foundation",
    "location": "Los Angeles, CA 90037",
    "date": "Ongoing",
    "time": null,
    "duration": null,
    "datetime_iso": "2026-02-11T00:01:00Z",
    "distance": "8 miles",
    "opportunity_type": "Volunteer Opportunity",
    "opportunity_url": "https://volunteer.laworks.com/opportunity/a0CQg0000AYITZGMQ5",
    "opportunity_id": "a0CQg0000AYITZGMQ5",
    "organization_url": "https://volunteer.laworks.com/organization/001Qg00000jFra0IAC",
    "scraped_at": "2026-02-11T17:58:25.579699"
  },
  {
    "title": "Harvest Fruit and Fight Hunger in Central Los Angeles!",
    "organization": "Food Forward",
    "location": "Toluca Lake, CA 91602",
    "date": "Ongoing",
    "time": null,
    "duration": null,
    "datetime_iso": "2024-02-22T00:01:00Z",
    "distance": "8 miles",
    "opportunity_type": "Volunteer Opportunity",
    "opportunity_url": "https://volunteer.laworks.com/opportunity/a0CQg00001O2Q3NMAV",
    "opportunity_id": "a0CQg00001O2Q3NMAV",
    "organization_url": "https://volunteer.laworks.com/organization/001A000000ixpvaIAA",
    "scraped_at": "2026-02-11T17:58:25.595997"
  },
  {
    "title": "Clean Ride Crew - Venice Blvd.",
    "organization": "Streets Are For Everyone",
    "location": "Los Angeles, CA 90232",
    "date": "2/28/26",
    "time": "9:30 AM",
    "duration": "2.5 hours",
    "datetime_iso": "2026-02-28T09:30:00Z",
    "distance": "9 miles",
    "opportunity_type": "Volunteer Opportunity",
    "opportunity_url": "https://volunteer.laworks.com/opportunity/a0CQg0000B3tXfcMQE",
    "opportunity_id": "a0CQg0000B3tXfcMQE",
    "organization_url": "https://volunteer.laworks.com/organization/001A000001P7hcqIAB",
    "scraped_at": "2026-02-11T17:58:25.618550"
  },
  {
    "title": "Fight Food Waste at the Melrose Place Farmers Market on Sundays!",
    "organization": "Food Forward",
    "location": "West Hollywood, CA 90069",
    "date": "Ongoing",
    "time": null,
    "duration": null,
    "datetime_iso": "2023-05-14T00:01:00Z",
    "distance": "9 miles",
    "opportunity_type": "Volunteer Opportunity",
    "opportunity_url": "https://volunteer.laworks.com/opportunity/a0C3l00000tWHFnEAO",
    "opportunity_id": "a0C3l00000tWHFnEAO",
    "organization_url": "https://volunteer.laworks.com/organization/001A000000ixpvaIAA",
    "scraped_at": "2026-02-11T17:58:25.635594"
  },
  {
    "title": "Land Restoration Workday - Day 2: Final Mulch Layer Altadena Post-Fire Soil Reme",
    "organization": "Community Compound: Dena Soil Project",
    "location": "Altadena, CA 91001",
    "date": "2/25/26",
    "time": "10:00 AM",
    "duration": "5 hours",
    "datetime_iso": "2026-02-25T10:00:00Z",
    "distance": "9 miles",
    "opportunity_type": "Volunteer Opportunity",
    "opportunity_url": "https://volunteer.laworks.com/opportunity/a0CQg0000B8YUxtMQG",
    "opportunity_id": "a0CQg0000B8YUxtMQG",
    "organization_url": "https://volunteer.laworks.com/organization/001Qg00000iV6G3IAK",
    "scraped_at": "2026-02-11T17:58:25.658994"
  },
  {
    "title": "Help our Unhoused Neighbors in North Hollywood",
    "organization": "NoHo Home Alliance",
    "location": "Los Angeles, CA 91602",
    "date": "Ongoing",
    "time": null,
    "duration": null,
    "datetime_iso": "2023-08-22T00:01:00Z",
    "distance": "9 miles",
    "opportunity_type": "Volunteer Opportunity",
    "opportunity_url": "https://volunteer.laworks.com/opportunity/a0C3l00000rUgqbEAC",
    "opportunity_id": "a0C3l00000rUgqbEAC",
    "organization_url": "https://volunteer.laworks.com/organization/0013l00002WBJSEAA5",
    "scraped_at": "2026-02-11T17:58:25.674355"
  },
  {
    "title": "Together we can make a difference. Help Unhoused Neighbors in North Hollywood",
    "organization": "NoHo Home Alliance",
    "location": "Los Angeles, CA 91602",
    "date": "2/18/26",
    "time": "8:15 AM",
    "duration": "3.5 hours",
    "datetime_iso": "2026-02-18T08:15:00Z",
    "distance": "9 miles",
    "opportunity_type": "Volunteer Opportunity",
    "opportunity_url": "https://volunteer.laworks.com/opportunity/a0CQg0000B3u4ciMQA",
    "opportunity_id": "a0CQg0000B3u4ciMQA",
    "organization_url": "https://volunteer.laworks.com/organization/0013l00002WBJSEAA5",
    "scraped_at": "2026-02-11T17:58:25.690115"
  },
  {
    "title": "Food Recovery Volunteers- MONDAY(Heart of Compassion)",
    "organization": "Heart of Compassion Distribution",
    "location": "Montebello, CA 90640",
    "date": "2/23/26",
    "time": "8:30 AM",
    "duration": "3 hours",
    "datetime_iso": "2026-02-23T08:30:00Z",
    "distance": "9 miles",
    "opportunity_type": "Volunteer Opportunity",
    "opportunity_url": "https://volunteer.laworks.com/opportunity/a0CQg0000ASp9yrMQB",
    "opportunity_id": "a0CQg0000ASp9yrMQB",
    "organization_url": "https://volunteer.laworks.com/organization/0013l00002He65EAAR",
    "scraped_at": "2026-02-11T17:58:25.706014"
  },
  {
    "title": "Food Distribution Volunteers-TUESDAY (Heart of Compassion)",
    "organization": "Heart of Compassion Distribution",
    "location": "Montebello, CA 90640",
    "date": "2/17/26",
    "time": "8:45 AM",
    "duration": "2.75 hours",
    "datetime_iso": "2026-02-17T08:45:00Z",
    "distance": "9 miles",
    "opportunity_type": "Volunteer Opportunity",
    "opportunity_url": "https://volunteer.laworks.com/opportunity/a0CQg0000ASkamjMQB",
    "opportunity_id": "a0CQg0000ASkamjMQB",
    "organization_url": "https://volunteer.laworks.com/organization/0013l00002He65EAAR",
    "scraped_at": "2026-02-11T17:58:25.721304"
  },
  {
    "title": "Food Distribution Volunteers- WEDNESDAY(Heart of Compassion)",
    "organization": "Heart of Compassion Distribution",
    "location": "Montebello, CA 90640",
    "date": "2/18/26",
    "time": "8:45 AM",
    "duration": "2.75 hours",
    "datetime_iso": "2026-02-18T08:45:00Z",
    "distance": "9 miles",
    "opportunity_type": "Volunteer Opportunity",
    "opportunity_url": "https://volunteer.laworks.com/opportunity/a0CQg0000ASkw5SMQR",
    "opportunity_id": "a0CQg0000ASkw5SMQR",
    "organization_url": "https://volunteer.laworks.com/organization/0013l00002He65EAAR",
    "scraped_at": "2026-02-11T17:58:25.736552"
  },
  {
    "title": "Standby Volunteer for Ace of Hearts Dog Rescue!",
    "organization": "Ace of Hearts",
    "location": "West Hollywood, CA 90048",
    "date": "Ongoing",
    "time": null,
    "duration": null,
    "datetime_iso": "2026-01-25T00:01:00Z",
    "distance": "10 miles",
    "opportunity_type": "Volunteer Opportunity",
    "opportunity_url": "https://volunteer.laworks.com/opportunity/a0CQg0000AsfjF3MQI",
    "opportunity_id": "a0CQg0000AsfjF3MQI",
    "organization_url": "https://volunteer.laworks.com/organization/0011N00001nuU4wQAE",
    "scraped_at": "2026-02-11T17:58:25.750252"
  },
  {
    "title": "Ace of Hearts Adoption Event",
    "organization": "Ace of Hearts",
    "location": "West Hollywood, CA 90048",
    "date": "2/14/26",
    "time": "3:00 PM",
    "duration": "3 hours",
    "datetime_iso": "2026-02-14T15:00:00Z",
    "distance": "10 miles",
    "opportunity_type": "Volunteer Opportunity",
    "opportunity_url": "https://volunteer.laworks.com/opportunity/a0CQg0000B2x9i1MQA",
    "opportunity_id": "a0CQg0000B2x9i1MQA",
    "organization_url": "https://volunteer.laworks.com/organization/0011N00001nuU4wQAE",
    "scraped_at": "2026-02-11T17:58:25.766292"
  },
  {
    "title": "Adoption and Fundraising Event 2/14",
    "organization": "Ace of Hearts",
    "location": "West Hollywood, CA 90048",
    "date": "2/14/26",
    "time": "3:00 PM",
    "duration": "3 hours",
    "datetime_iso": "2026-02-14T15:00:00Z",
    "distance": "10 miles",
    "opportunity_type": "Volunteer Opportunity",
    "opportunity_url": "https://volunteer.laworks.com/opportunity/a0CQg0000B2wYRDMQ2",
    "opportunity_id": "a0CQg0000B2wYRDMQ2",
    "organization_url": "https://volunteer.laworks.com/organization/0011N00001nuU4wQAE",
    "scraped_at": "2026-02-11T17:58:25.784723"
  },
  {
    "title": "Volunteer for Emergency Child Care Network",
    "organization": "National Emergency Child Care Network",
    "location": "Firestone Park, CA 90001",
    "date": "Ongoing",
    "time": null,
    "duration": null,
    "datetime_iso": "2025-03-04T00:01:00Z",
    "distance": "10 miles",
    "opportunity_type": "Volunteer Opportunity",
    "opportunity_url": "https://volunteer.laworks.com/opportunity/a0CQg00005pQpTgMAK",
    "opportunity_id": "a0CQg00005pQpTgMAK",
    "organization_url": "https://volunteer.laworks.com/organization/001Qg00000Nf5JWIAZ",
    "scraped_at": "2026-02-11T17:58:25.797905"
  },
  {
    "title": "Project Leaders: Help Support a Public Art Event: \"Attune\"",
    "organization": "NXT Art Foundation",
    "location": "Los Angeles, CA 90001",
    "date": "2/14/26",
    "time": "3:00 PM",
    "duration": "3 hours",
    "datetime_iso": "2026-02-14T15:00:00Z",
    "distance": "10 miles",
    "opportunity_type": "Volunteer Opportunity",
    "opportunity_url": "https://volunteer.laworks.com/opportunity/a0CQg0000AkMHMIMQ4",
    "opportunity_id": "a0CQg0000AkMHMIMQ4",
    "organization_url": "https://volunteer.laworks.com/organization/001Qg00000H7Q6LIAV",
    "scraped_at": "2026-02-11T17:58:25.813120"
  },
  {
    "title": "Attune",
    "organization": "NXT Art Foundation",
    "location": "Los Angeles, CA 90001",
    "date": "2/14/26",
    "time": "3:00 PM",
    "duration": "6 hours",
    "datetime_iso": "2026-02-14T15:00:00Z",
    "distance": "10 miles",
    "opportunity_type": "Volunteer Opportunity",
    "opportunity_url": "https://volunteer.laworks.com/opportunity/a0CQg00009zfbbzMAA",
    "opportunity_id": "a0CQg00009zfbbzMAA",
    "organization_url": "https://volunteer.laworks.com/organization/001Qg00000H7Q6LIAV",
    "scraped_at": "2026-02-11T17:58:25.829007"
  },
  {
    "title": "American Red Cross - Blood Delivery Driver (Culver City) - Van Provided",
    "organization": "American Red Cross Los Angeles Region",
    "location": "Culver City, CA 90016",
    "date": "Ongoing",
    "time": null,
    "duration": null,
    "datetime_iso": "2022-08-10T00:01:00Z",
    "distance": "10 miles",
    "opportunity_type": "Volunteer Opportunity",
    "opportunity_url": "https://volunteer.laworks.com/opportunity/a0C3l00000r4ZaSEAU",
    "opportunity_id": "a0C3l00000r4ZaSEAU",
    "organization_url": "https://volunteer.laworks.com/organization/001A000000a9b0aIAA",
    "scraped_at": "2026-02-11T17:58:25.842505"
  },
  {
    "title": "Pantry Distribution at SOVA Food Pantry â€¢ Pico Blvd (at Robertson Blvd)",
    "organization": "Jewish Family Service of Los Angeles",
    "location": "Los Angeles, CA 90035",
    "date": "2/12/26",
    "time": "9:00 AM",
    "duration": "4.5 hours",
    "datetime_iso": "2026-02-12T09:00:00Z",
    "distance": "10 miles",
    "opportunity_type": "Volunteer Opportunity",
    "opportunity_url": "https://volunteer.laworks.com/opportunity/a0CQg0000AxWN4IMQW",
    "opportunity_id": "a0CQg0000AxWN4IMQW",
    "organization_url": "https://volunteer.laworks.com/organization/001A000000a9ah1IAA",
    "scraped_at": "2026-02-11T17:58:25.860337"
  },
  {
    "title": "American Red Cross - Disaster Duty Officer - San Gabriel & Pomona Valleys",
    "organization": "American Red Cross Los Angeles Region",
    "location": "Arcadia, CA 91007",
    "date": "Ongoing",
    "time": null,
    "duration": null,
    "datetime_iso": "2024-01-24T00:01:00Z",
    "distance": "10 miles",
    "opportunity_type": "Volunteer Opportunity",
    "opportunity_url": "https://volunteer.laworks.com/opportunity/a0CQg00001704NFMAY",
    "opportunity_id": "a0CQg00001704NFMAY",
    "organization_url": "https://volunteer.laworks.com/organization/001A000000a9b0aIAA",
    "scraped_at": "2026-02-11T17:58:25.874099"
  },
  {
    "title": "Fight Hunger & Food Waste at the Studio City Farmers Market on Sundays!",
    "organization": "Food Forward",
    "location": "Los Angeles, CA 91604",
    "date": "Ongoing",
    "time": null,
    "duration": null,
    "datetime_iso": "2022-07-13T00:01:00Z",
    "distance": "10 miles",
    "opportunity_type": "Volunteer Opportunity",
    "opportunity_url": "https://volunteer.laworks.com/opportunity/a0C3l00000r4CQ5EAM",
    "opportunity_id": "a0C3l00000r4CQ5EAM",
    "organization_url": "https://volunteer.laworks.com/organization/001A000000ixpvaIAA",
    "scraped_at": "2026-02-11T17:58:25.893691"
  },
  {
    "title": "Red Cross: Service to the Armed Forces Presenter - San Gabriel & Pomona Valleys",
    "organization": "American Red Cross Los Angeles Region",
    "location": "Arcadia, CA 91007",
    "date": "Ongoing",
    "time": null,
    "duration": null,
    "datetime_iso": "2023-12-19T00:01:00Z",
    "distance": "10 miles",
    "opportunity_type": "Volunteer Opportunity",
    "opportunity_url": "https://volunteer.laworks.com/opportunity/a0CQg00000moUldMAE",
    "opportunity_id": "a0CQg00000moUldMAE",
    "organization_url": "https://volunteer.laworks.com/organization/001A000000a9b0aIAA",
    "scraped_at": "2026-02-11T17:58:25.913410"
  },
  {
    "title": "Baby2Baby Winter Internship 2025 | Program Intern",
    "organization": "Baby2Baby",
    "location": "Los Angeles, CA 90016",
    "date": "12/19/26",
    "time": "9:00 AM",
    "duration": "9 hours",
    "datetime_iso": "2026-12-19T09:00:00Z",
    "distance": "10 miles",
    "opportunity_type": "Volunteer Opportunity",
    "opportunity_url": "https://volunteer.laworks.com/opportunity/a0CQg00009eOb1EMAS",
    "opportunity_id": "a0CQg00009eOb1EMAS",
    "organization_url": "https://volunteer.laworks.com/organization/001A000000a9b2lIAA",
    "scraped_at": "2026-02-11T17:58:25.931555"
  },
  {
    "title": "SPRUCE IT UP: Revitalize TreePeople Park",
    "organization": "TreePeople",
    "location": "Beverly Hills, CA 90210",
    "date": "2/14/26",
    "time": "9:00 AM",
    "duration": "3 hours",
    "datetime_iso": "2026-02-14T09:00:00Z",
    "distance": "11 miles",
    "opportunity_type": "Volunteer Opportunity",
    "opportunity_url": "https://volunteer.laworks.com/opportunity/a0CQg0000AWUNEUMQ5",
    "opportunity_id": "a0CQg0000AWUNEUMQ5",
    "organization_url": "https://volunteer.laworks.com/organization/001A000000a9aOiIAI",
    "scraped_at": "2026-02-11T17:58:25.949957"
  },
  {
    "title": "Compost Hub Support: CultivaLA Farm",
    "organization": "LA Compost",
    "location": "South El Monte, CA 91733",
    "date": "2/13/26",
    "time": "8:30 AM",
    "duration": "3.5 hours",
    "datetime_iso": "2026-02-13T08:30:00Z",
    "distance": "11 miles",
    "opportunity_type": "Volunteer Opportunity",
    "opportunity_url": "https://volunteer.laworks.com/opportunity/a0CQg0000AUle5VMQR",
    "opportunity_id": "a0CQg0000AUle5VMQR",
    "organization_url": "https://volunteer.laworks.com/organization/0013l00002UlHqzAAF",
    "scraped_at": "2026-02-11T17:58:25.968783"
  },
  {
    "title": "Stage and Furnish Homes for Families Displaced by the LA Fires",
    "organization": "A Sense of Home",
    "location": "El Monte, CA 91731",
    "date": "2/12/26",
    "time": "10:00 AM",
    "duration": "2.5 hours",
    "datetime_iso": "2026-02-12T10:00:00Z",
    "distance": "11 miles",
    "opportunity_type": "Special Event",
    "opportunity_url": "https://volunteer.laworks.com/opportunity/a0CQg0000AGF1CGMQ1",
    "opportunity_id": "a0CQg0000AGF1CGMQ1",
    "organization_url": "https://volunteer.laworks.com/organization/0011N00001euJ2jQAE",
    "scraped_at": "2026-02-11T17:58:25.986414"
  },
  {
    "title": "Fight Food Waste at the Culver City Farmers Market on Tuesdays!",
    "organization": "Food Forward",
    "location": "Culver City, CA 90232",
    "date": "Ongoing",
    "time": null,
    "duration": null,
    "datetime_iso": "2024-02-23T00:01:00Z",
    "distance": "11 miles",
    "opportunity_type": "Volunteer Opportunity",
    "opportunity_url": "https://volunteer.laworks.com/opportunity/a0CQg00001OhBBbMAN",
    "opportunity_id": "a0CQg00001OhBBbMAN",
    "organization_url": "https://volunteer.laworks.com/organization/001A000000ixpvaIAA",
    "scraped_at": "2026-02-11T17:58:26.001345"
  },
  {
    "title": "February 2026 Community Garden Day at 99th Street Elementary",
    "organization": "Garden School Foundation",
    "location": "Los Angeles, CA 90002",
    "date": "2/28/26",
    "time": "9:00 AM",
    "duration": "3 hours",
    "datetime_iso": "2026-02-28T09:00:00Z",
    "distance": "11 miles",
    "opportunity_type": "Volunteer Opportunity",
    "opportunity_url": "https://volunteer.laworks.com/opportunity/a0CQg0000ASl9T8MQJ",
    "opportunity_id": "a0CQg0000ASl9T8MQJ",
    "organization_url": "https://volunteer.laworks.com/organization/001A000000qjVDoIAM",
    "scraped_at": "2026-02-11T17:58:26.017885"
  },
  {
    "title": "MudTown Farms Volunteer Days",
    "organization": "Watts Labor Community Action Committee",
    "location": "Los Angeles, CA 90002",
    "date": "2/14/26",
    "time": "7:30 AM",
    "duration": "3.5 hours",
    "datetime_iso": "2026-02-14T07:30:00Z",
    "distance": "11 miles",
    "opportunity_type": "Volunteer Opportunity",
    "opportunity_url": "https://volunteer.laworks.com/opportunity/a0CQg00005pR8IFMA0",
    "opportunity_id": "a0CQg00005pR8IFMA0",
    "organization_url": "https://volunteer.laworks.com/organization/001A000000a9afnIAA",
    "scraped_at": "2026-02-11T17:58:26.033861"
  },
  {
    "title": "Support an Edible School Garden",
    "organization": "Arroyo Farm Lab",
    "location": "El Monte, CA 91732",
    "date": "3/21/26",
    "time": "9:00 AM",
    "duration": "3 hours",
    "datetime_iso": "2026-03-21T09:00:00Z",
    "distance": "12 miles",
    "opportunity_type": "Volunteer Opportunity",
    "opportunity_url": "https://volunteer.laworks.com/opportunity/a0CQg0000B09aNBMQY",
    "opportunity_id": "a0CQg0000B09aNBMQY",
    "organization_url": "https://volunteer.laworks.com/organization/0013l00002d3IRdAAM",
    "scraped_at": "2026-02-11T17:58:26.049131"
  },
  {
    "title": "Volunteer with Freedom Farms",
    "organization": "Partnership for Growth Los Angeles",
    "location": "Los Angeles, CA 90047",
    "date": "2/13/26",
    "time": "10:00 AM",
    "duration": "3 hours",
    "datetime_iso": "2026-02-13T10:00:00Z",
    "distance": "12 miles",
    "opportunity_type": "Volunteer Opportunity",
    "opportunity_url": "https://volunteer.laworks.com/opportunity/a0CQg0000ARwEsaMQF",
    "opportunity_id": "a0CQg0000ARwEsaMQF",
    "organization_url": "https://volunteer.laworks.com/organization/001Qg00000RDH3XIAX",
    "scraped_at": "2026-02-11T17:58:26.064746"
  },
  {
    "title": "BE A KID AGAIN: Game Night with Midnight Mission's Youth",
    "organization": "The Midnight Mission",
    "location": "Inglewood, CA 90302",
    "date": "2/17/26",
    "time": "6:30 PM",
    "duration": "1.75 hours",
    "datetime_iso": "2026-02-17T18:30:00Z",
    "distance": "12 miles",
    "opportunity_type": "Volunteer Opportunity",
    "opportunity_url": "https://volunteer.laworks.com/opportunity/a0CQg00009yqtqKMAQ",
    "opportunity_id": "a0CQg00009yqtqKMAQ",
    "organization_url": "https://volunteer.laworks.com/organization/001A000000a9aPCIAY",
    "scraped_at": "2026-02-11T17:58:26.080667"
  },
  {
    "title": "Share the Warmth: Blanket Donation Drive",
    "organization": "L.A. Family Housing",
    "location": "Los Angeles, CA 91605",
    "date": "Ongoing",
    "time": null,
    "duration": null,
    "datetime_iso": "2025-06-05T00:01:00Z",
    "distance": "12 miles",
    "opportunity_type": "Volunteer Opportunity",
    "opportunity_url": "https://volunteer.laworks.com/opportunity/a0CQg00007FgL14MAF",
    "opportunity_id": "a0CQg00007FgL14MAF",
    "organization_url": "https://volunteer.laworks.com/organization/001A000000a9a2hIAA",
    "scraped_at": "2026-02-11T17:58:26.093700"
  },
  {
    "title": "MudTown Farms Free Produce Giveaway at Watts Labor Community Action Committee",
    "organization": "Watts Labor Community Action Committee",
    "location": "Los Angeles, CA 90059",
    "date": "2/18/26",
    "time": "7:30 AM",
    "duration": "3 hours",
    "datetime_iso": "2026-02-18T07:30:00Z",
    "distance": "12 miles",
    "opportunity_type": "Special Event",
    "opportunity_url": "https://volunteer.laworks.com/opportunity/a0CQg00005pRI3nMAG",
    "opportunity_id": "a0CQg00005pRI3nMAG",
    "organization_url": "https://volunteer.laworks.com/organization/001A000000a9afnIAA",
    "scraped_at": "2026-02-11T17:58:26.110829"
  },
  {
    "title": "Game Nights in North Hollywood (Volunteer Training Req.)",
    "organization": "L.A. Family Housing",
    "location": "Los Angeles, CA 91605",
    "date": "2/11/26",
    "time": "6:00 AM",
    "duration": "13.5 hours",
    "datetime_iso": "2026-02-11T06:00:00Z",
    "distance": "12 miles",
    "opportunity_type": "Volunteer Opportunity",
    "opportunity_url": "https://volunteer.laworks.com/opportunity/a0CQg0000AUbYceMQF",
    "opportunity_id": "a0CQg0000AUbYceMQF",
    "organization_url": "https://volunteer.laworks.com/organization/001A000000a9a2hIAA",
    "scraped_at": "2026-02-11T17:58:26.126516"
  },
  {
    "title": "Assemble Food Packages for Families!",
    "organization": "Los Angeles Regional Food Bank",
    "location": "City of Industry, CA 90601",
    "date": "Ongoing",
    "time": null,
    "duration": null,
    "datetime_iso": "2025-01-08T00:01:00Z",
    "distance": "12 miles",
    "opportunity_type": "Special Event",
    "opportunity_url": "https://volunteer.laworks.com/opportunity/a0CQg0000516UZnMAM",
    "opportunity_id": "a0CQg0000516UZnMAM",
    "organization_url": "https://volunteer.laworks.com/organization/001A000000a9aOgIAI",
    "scraped_at": "2026-02-11T17:58:26.139825"
  },
  {
    "title": "Volunteer at American Red Cross Blood Drives (No Blood Drawing) - Culver City",
    "organization": "American Red Cross Los Angeles Region",
    "location": "Culver City, CA 90230",
    "date": "Ongoing",
    "time": null,
    "duration": null,
    "datetime_iso": "2025-09-19T00:01:00Z",
    "distance": "13 miles",
    "opportunity_type": "Volunteer Opportunity",
    "opportunity_url": "https://volunteer.laworks.com/opportunity/a0CQg00008uOvo1MAC",
    "opportunity_id": "a0CQg00008uOvo1MAC",
    "organization_url": "https://volunteer.laworks.com/organization/001A000000a9b0aIAA",
    "scraped_at": "2026-02-11T17:58:26.153029"
  },
  {
    "title": "Project Leaders: Help Support an Art Fair in Inglewood",
    "organization": "Elevate Culture Corporation",
    "location": "Inglewood, CA 90305",
    "date": "2/27/26",
    "time": "9:30 AM",
    "duration": "4.5 hours",
    "datetime_iso": "2026-02-27T09:30:00Z",
    "distance": "13 miles",
    "opportunity_type": "Special Event",
    "opportunity_url": "https://volunteer.laworks.com/opportunity/a0CQg0000B26bZgMQI",
    "opportunity_id": "a0CQg0000B26bZgMQI",
    "organization_url": "https://volunteer.laworks.com/organization/0013l00002eyVheAAE",
    "scraped_at": "2026-02-11T17:58:26.168264"
  },
  {
    "title": "Help Support an Art Fair in Inglewood",
    "organization": "Elevate Culture Corporation",
    "location": "Inglewood, CA 90305",
    "date": "2/27/26",
    "time": "9:30 AM",
    "duration": "4.5 hours",
    "datetime_iso": "2026-02-27T09:30:00Z",
    "distance": "13 miles",
    "opportunity_type": "Special Event",
    "opportunity_url": "https://volunteer.laworks.com/opportunity/a0CQg0000B1F165MQC",
    "opportunity_id": "a0CQg0000B1F165MQC",
    "organization_url": "https://volunteer.laworks.com/organization/0013l00002eyVheAAE",
    "scraped_at": "2026-02-11T17:58:26.183342"
  },
  {
    "title": "ReMATRIATION Day: Give Love Back to the Land This Valentine's Weekend",
    "organization": "Sunland-Tujunga Forward",
    "location": "Los Angeles, CA 91042",
    "date": "2/15/26",
    "time": "9:30 AM",
    "duration": "3 hours",
    "datetime_iso": "2026-02-15T09:30:00Z",
    "distance": "13 miles",
    "opportunity_type": "Volunteer Opportunity",
    "opportunity_url": "https://volunteer.laworks.com/opportunity/a0CQg0000AuSXgcMQG",
    "opportunity_id": "a0CQg0000AuSXgcMQG",
    "organization_url": "https://volunteer.laworks.com/organization/001Qg00000KSn5WIAT",
    "scraped_at": "2026-02-11T17:58:26.216488"
  },
  {
    "title": "PS Science Service Squad",
    "organization": "PS Science",
    "location": "Inglewood, CA 90301",
    "date": "2/14/26",
    "time": "9:30 AM",
    "duration": "2 hours",
    "datetime_iso": "2026-02-14T09:30:00Z",
    "distance": "14 miles",
    "opportunity_type": "Volunteer Opportunity",
    "opportunity_url": "https://volunteer.laworks.com/opportunity/a0CQg00008PW0O4MAL",
    "opportunity_id": "a0CQg00008PW0O4MAL",
    "organization_url": "https://volunteer.laworks.com/organization/0011N00001hObGMQA0",
    "scraped_at": "2026-02-11T17:58:26.233279"
  },
  {
    "title": "American Red Cross -Disaster Action Team- Glendale, Pomona, San Gabriel Valley",
    "organization": "American Red Cross Los Angeles Region",
    "location": "Los Angeles, CA 90025",
    "date": "Ongoing",
    "time": null,
    "duration": null,
    "datetime_iso": "2022-09-14T00:01:00Z",
    "distance": "14 miles",
    "opportunity_type": "Volunteer Opportunity",
    "opportunity_url": "https://volunteer.laworks.com/opportunity/a0C3l00000r52Q7EAI",
    "opportunity_id": "a0C3l00000r52Q7EAI",
    "organization_url": "https://volunteer.laworks.com/organization/001A000000a9b0aIAA",
    "scraped_at": "2026-02-11T17:58:26.247025"
  },
  {
    "title": "Fight Food Waste at the Mar Vista Farmers Market on Sundays!",
    "organization": "Food Forward",
    "location": "Los Angeles, CA 90066",
    "date": "Ongoing",
    "time": null,
    "duration": null,
    "datetime_iso": "2022-04-06T00:01:00Z",
    "distance": "14 miles",
    "opportunity_type": "Volunteer Opportunity",
    "opportunity_url": "https://volunteer.laworks.com/opportunity/a0C3l00000ojfPsEAI",
    "opportunity_id": "a0C3l00000ojfPsEAI",
    "organization_url": "https://volunteer.laworks.com/organization/001A000000ixpvaIAA",
    "scraped_at": "2026-02-11T17:58:26.260907"
  },
  {
    "title": "Compost Hub Support: Cottonwood Urban Farm",
    "organization": "LA Compost",
    "location": "Los Angeles, CA 91402",
    "date": "2/25/26",
    "time": "12:30 PM",
    "duration": "1.5 hours",
    "datetime_iso": "2026-02-25T12:30:00Z",
    "distance": "14 miles",
    "opportunity_type": "Volunteer Opportunity",
    "opportunity_url": "https://volunteer.laworks.com/opportunity/a0CQg0000AUlNEPMQ3",
    "opportunity_id": "a0CQg0000AUlNEPMQ3",
    "organization_url": "https://volunteer.laworks.com/organization/0013l00002UlHqzAAF",
    "scraped_at": "2026-02-11T17:58:26.276863"
  },
  {
    "title": "Emerson Avenue Community Garden Community Volunteer Day",
    "organization": "Emerson Avenue Community Garden",
    "location": "Los Angeles, CA 90045",
    "date": "3/7/26",
    "time": "9:00 AM",
    "duration": "3.5 hours",
    "datetime_iso": "2026-03-07T09:00:00Z",
    "distance": "14 miles",
    "opportunity_type": "Volunteer Opportunity",
    "opportunity_url": "https://volunteer.laworks.com/opportunity/a0CQg0000AJ8cCKMQZ",
    "opportunity_id": "a0CQg0000AJ8cCKMQZ",
    "organization_url": "https://volunteer.laworks.com/organization/0013l00002Y6NpdAAF",
    "scraped_at": "2026-02-11T17:58:26.293095"
  },
  {
    "title": "Classroom Volunteer",
    "organization": "Girls Inc. of Los Angeles",
    "location": "Los Angeles, CA 90003",
    "date": "2/12/26",
    "time": "1:30 PM",
    "duration": "2 hours",
    "datetime_iso": "2026-02-12T13:30:00Z",
    "distance": "14 miles",
    "opportunity_type": "Volunteer Opportunity",
    "opportunity_url": "https://volunteer.laworks.com/opportunity/a0CQg0000AZCTbsMQH",
    "opportunity_id": "a0CQg0000AZCTbsMQH",
    "organization_url": "https://volunteer.laworks.com/organization/0013l00002gqXTTAA2",
    "scraped_at": "2026-02-11T17:58:26.308929"
  },
  {
    "title": "Red Cross: Local Disaster Response Volunteer - SFV, Santa Clarita, Antelope V",
    "organization": "American Red Cross Los Angeles Region",
    "location": "Los Angeles, CA 91411",
    "date": "Ongoing",
    "time": null,
    "duration": null,
    "datetime_iso": "2024-01-29T00:01:00Z",
    "distance": "14 miles",
    "opportunity_type": "Volunteer Opportunity",
    "opportunity_url": "https://volunteer.laworks.com/opportunity/a0CQg000019KePiMAK",
    "opportunity_id": "a0CQg000019KePiMAK",
    "organization_url": "https://volunteer.laworks.com/organization/001A000000a9b0aIAA",
    "scraped_at": "2026-02-11T17:58:26.322292"
  },
  {
    "title": "American Red Cross - Disaster Duty Officer - San Fernando, Santa Clarita & AV",
    "organization": "American Red Cross Los Angeles Region",
    "location": "Los Angeles, CA 91411",
    "date": "Ongoing",
    "time": null,
    "duration": null,
    "datetime_iso": "2024-01-24T00:01:00Z",
    "distance": "14 miles",
    "opportunity_type": "Volunteer Opportunity",
    "opportunity_url": "https://volunteer.laworks.com/opportunity/a0CQg000016ztYiMAI",
    "opportunity_id": "a0CQg000016ztYiMAI",
    "organization_url": "https://volunteer.laworks.com/organization/001A000000a9b0aIAA",
    "scraped_at": "2026-02-11T17:58:26.341953"
  },
  {
    "title": "American Red Cross - Disaster Duty Officer - Metro and Southeast Los Angeles",
    "organization": "American Red Cross Los Angeles Region",
    "location": "Los Angeles, CA 90021",
    "date": "Ongoing",
    "time": null,
    "duration": null,
    "datetime_iso": "2024-01-24T00:01:00Z",
    "distance": "15 miles",
    "opportunity_type": "Volunteer Opportunity",
    "opportunity_url": "https://volunteer.laworks.com/opportunity/a0CQg000016zCrrMAE",
    "opportunity_id": "a0CQg000016zCrrMAE",
    "organization_url": "https://volunteer.laworks.com/organization/001A000000a9b0aIAA",
    "scraped_at": "2026-02-11T17:58:26.357375"
  },
  {
    "title": "Garden Harvest at S.O.W Collective's Arleta Farm",
    "organization": "Shift Our Ways Collective",
    "location": "Los Angeles, CA 91331",
    "date": "2/18/26",
    "time": "2:00 PM",
    "duration": "3 hours",
    "datetime_iso": "2026-02-18T14:00:00Z",
    "distance": "15 miles",
    "opportunity_type": "Volunteer Opportunity",
    "opportunity_url": "https://volunteer.laworks.com/opportunity/a0CQg00009OrVTNMA3",
    "opportunity_id": "a0CQg00009OrVTNMA3",
    "organization_url": "https://volunteer.laworks.com/organization/001Qg00000FJKIZIA5",
    "scraped_at": "2026-02-11T17:58:26.375155"
  },
  {
    "title": "Volunteers Needed for WeSPARK Cancer Support Center's RUN/WALK 5K/10K",
    "organization": "WeSPARK Cancer Support Center",
    "location": "Los Angeles, CA 91316",
    "date": "2/22/26",
    "time": "6:30 AM",
    "duration": "5.5 hours",
    "datetime_iso": "2026-02-22T06:30:00Z",
    "distance": "16 miles",
    "opportunity_type": "Volunteer Opportunity",
    "opportunity_url": "https://volunteer.laworks.com/opportunity/a0CQg0000AmwrZSMQY",
    "opportunity_id": "a0CQg0000AmwrZSMQY",
    "organization_url": "https://volunteer.laworks.com/organization/001A000000a9b3YIAQ",
    "scraped_at": "2026-02-11T17:58:26.393825"
  },
  {
    "title": "Foster a Rescue Dog!",
    "organization": "Ace of Hearts",
    "location": "Los Angeles, CA 90049",
    "date": "Ongoing",
    "time": null,
    "duration": null,
    "datetime_iso": "2026-01-28T00:01:00Z",
    "distance": "16 miles",
    "opportunity_type": "Volunteer Opportunity",
    "opportunity_url": "https://volunteer.laworks.com/opportunity/a0CQg0000AupHbMMQU",
    "opportunity_id": "a0CQg0000AupHbMMQU",
    "organization_url": "https://volunteer.laworks.com/organization/0011N00001nuU4wQAE",
    "scraped_at": "2026-02-11T17:58:26.410138"
  },
  {
    "title": "Empower Futures with Chrysalis in San Fernando Valley!",
    "organization": "Chrysalis",
    "location": "Los Angeles, CA 91331",
    "date": "Ongoing",
    "time": null,
    "duration": null,
    "datetime_iso": "2026-01-27T00:01:00Z",
    "distance": "16 miles",
    "opportunity_type": "Volunteer Opportunity",
    "opportunity_url": "https://volunteer.laworks.com/opportunity/a0CQg0000Aup90hMQA",
    "opportunity_id": "a0CQg0000Aup90hMQA",
    "organization_url": "https://volunteer.laworks.com/organization/001A000000a9aR7IAI",
    "scraped_at": "2026-02-11T17:58:26.424935"
  },
  {
    "title": "Ballona Wetlands Habitat Stewardship",
    "organization": "Ballona Wetlands Land Trust",
    "location": "Marina del Rey, CA 90292",
    "date": "2/14/26",
    "time": "9:00 AM",
    "duration": "2 hours",
    "datetime_iso": "2026-02-14T09:00:00Z",
    "distance": "16 miles",
    "opportunity_type": "Volunteer Opportunity",
    "opportunity_url": "https://volunteer.laworks.com/opportunity/a0CQg0000AWUYoPMQX",
    "opportunity_id": "a0CQg0000AWUYoPMQX",
    "organization_url": "https://volunteer.laworks.com/organization/001A000000a9aPbIAI",
    "scraped_at": "2026-02-11T17:58:26.441557"
  },
  {
    "title": "Empowering Women: Be a Mentor with CLARE Matrix Workshop",
    "organization": "CLARE Foundation",
    "location": "Santa Monica, CA 90405",
    "date": "2/21/26",
    "time": "10:00 AM",
    "duration": "1.5 hours",
    "datetime_iso": "2026-02-21T10:00:00Z",
    "distance": "16 miles",
    "opportunity_type": "Volunteer Opportunity",
    "opportunity_url": "https://volunteer.laworks.com/opportunity/a0CQg0000Awdr5JMQQ",
    "opportunity_id": "a0CQg0000Awdr5JMQQ",
    "organization_url": "https://volunteer.laworks.com/organization/0011N00001VatNgQAJ",
    "scraped_at": "2026-02-11T17:58:26.459377"
  },
  {
    "title": "Empower Futures with Chrysalis in Santa Monica!",
    "organization": "Chrysalis",
    "location": "Santa Monica, CA 90404",
    "date": "Ongoing",
    "time": null,
    "duration": null,
    "datetime_iso": "2026-01-27T00:01:00Z",
    "distance": "16 miles",
    "opportunity_type": "Volunteer Opportunity",
    "opportunity_url": "https://volunteer.laworks.com/opportunity/a0CQg0000AupHSuMQM",
    "opportunity_id": "a0CQg0000AupHSuMQM",
    "organization_url": "https://volunteer.laworks.com/organization/001A000000a9aR7IAI",
    "scraped_at": "2026-02-11T17:58:26.473993"
  },
  {
    "title": "American Red Cross - Disaster Duty Officer - West Los Angeles",
    "organization": "American Red Cross Los Angeles Region",
    "location": "Santa Monica, CA 90401",
    "date": "Ongoing",
    "time": null,
    "duration": null,
    "datetime_iso": "2024-01-04T00:01:00Z",
    "distance": "16 miles",
    "opportunity_type": "Volunteer Opportunity",
    "opportunity_url": "https://volunteer.laworks.com/opportunity/a0CQg00000u4zCtMAI",
    "opportunity_id": "a0CQg00000u4zCtMAI",
    "organization_url": "https://volunteer.laworks.com/organization/001A000000a9b0aIAA",
    "scraped_at": "2026-02-11T17:58:26.487378"
  },
  {
    "title": "American Red Cross - Disaster Action Team Volunteer",
    "organization": "American Red Cross Los Angeles Region",
    "location": "Santa Monica, CA 90401",
    "date": "Ongoing",
    "time": null,
    "duration": null,
    "datetime_iso": "2024-01-04T00:01:00Z",
    "distance": "16 miles",
    "opportunity_type": "Volunteer Opportunity",
    "opportunity_url": "https://volunteer.laworks.com/opportunity/a0CQg00000ufyjQMAQ",
    "opportunity_id": "a0CQg00000ufyjQMAQ",
    "organization_url": "https://volunteer.laworks.com/organization/001A000000a9b0aIAA",
    "scraped_at": "2026-02-11T17:58:26.501146"
  },
  {
    "title": "Red Cross: Local Disaster Response Volunteer - Santa Monica, West Los Angeles",
    "organization": "American Red Cross Los Angeles Region",
    "location": "Santa Monica, CA 90401",
    "date": "Ongoing",
    "time": null,
    "duration": null,
    "datetime_iso": "2024-01-24T00:01:00Z",
    "distance": "16 miles",
    "opportunity_type": "Volunteer Opportunity",
    "opportunity_url": "https://volunteer.laworks.com/opportunity/a0CQg000019MRbAMAW",
    "opportunity_id": "a0CQg000019MRbAMAW",
    "organization_url": "https://volunteer.laworks.com/organization/001A000000a9b0aIAA",
    "scraped_at": "2026-02-11T17:58:26.515765"
  },
  {
    "title": "CareerSpring Advisors - Multiple Virtual Options",
    "organization": "CareerSpring",
    "location": "Santa Monica, CA 90402",
    "date": "Ongoing",
    "time": null,
    "duration": null,
    "datetime_iso": "2024-09-26T00:01:00Z",
    "distance": "16 miles",
    "opportunity_type": "Volunteer Opportunity",
    "opportunity_url": "https://volunteer.laworks.com/opportunity/a0CQg00003ZItOZMA1",
    "opportunity_id": "a0CQg00003ZItOZMA1",
    "organization_url": "https://volunteer.laworks.com/organization/001Qg00000HQGk9IAH",
    "scraped_at": "2026-02-11T17:58:26.529713"
  },
  {
    "title": "Support Women Through Mentoring",
    "organization": "Harvest Home",
    "location": "Santa Monica, CA 90403",
    "date": "3/21/26",
    "time": "10:30 AM",
    "duration": "1.5 hours",
    "datetime_iso": "2026-03-21T10:30:00Z",
    "distance": "17 miles",
    "opportunity_type": "Volunteer Opportunity",
    "opportunity_url": "https://volunteer.laworks.com/opportunity/a0CQg0000B6t7HWMQY",
    "opportunity_id": "a0CQg0000B6t7HWMQY",
    "organization_url": "https://volunteer.laworks.com/organization/0011N00001L3dBpQAJ",
    "scraped_at": "2026-02-11T17:58:26.546085"
  },
  {
    "title": "Fight Food Waste at the Encino Farmers Market on Sundays!",
    "organization": "Food Forward",
    "location": "Los Angeles, CA 91406",
    "date": "Ongoing",
    "time": null,
    "duration": null,
    "datetime_iso": "2023-05-14T00:01:00Z",
    "distance": "17 miles",
    "opportunity_type": "Volunteer Opportunity",
    "opportunity_url": "https://volunteer.laworks.com/opportunity/a0C3l00000tWGW2EAO",
    "opportunity_id": "a0C3l00000tWGW2EAO",
    "organization_url": "https://volunteer.laworks.com/organization/001A000000ixpvaIAA",
    "scraped_at": "2026-02-11T17:58:26.561156"
  },
  {
    "title": "Harvest Fruit and Fight Hunger in West Los Angeles!",
    "organization": "Food Forward",
    "location": "Santa Monica, CA 90401",
    "date": "Ongoing",
    "time": null,
    "duration": null,
    "datetime_iso": "2024-02-22T00:01:00Z",
    "distance": "17 miles",
    "opportunity_type": "Volunteer Opportunity",
    "opportunity_url": "https://volunteer.laworks.com/opportunity/a0CQg00001O2Gw4MAF",
    "opportunity_id": "a0CQg00001O2Gw4MAF",
    "organization_url": "https://volunteer.laworks.com/organization/001A000000ixpvaIAA",
    "scraped_at": "2026-02-11T17:58:26.574932"
  },
  {
    "title": "Fight Food Waste at the Santa Monica Farmers Market on Wednesdays!",
    "organization": "Food Forward",
    "location": "Santa Monica, CA 90401",
    "date": "Ongoing",
    "time": null,
    "duration": null,
    "datetime_iso": "2024-02-23T00:01:00Z",
    "distance": "17 miles",
    "opportunity_type": "Volunteer Opportunity",
    "opportunity_url": "https://volunteer.laworks.com/opportunity/a0CQg00001Oh2S0MAJ",
    "opportunity_id": "a0CQg00001Oh2S0MAJ",
    "organization_url": "https://volunteer.laworks.com/organization/001A000000ixpvaIAA",
    "scraped_at": "2026-02-11T17:58:26.587871"
  },
  {
    "title": "March 2026 Community Garden Day at Annalee Elementary",
    "organization": "Garden School Foundation",
    "location": "Carson, CA 90746",
    "date": "3/7/26",
    "time": "9:00 AM",
    "duration": "3 hours",
    "datetime_iso": "2026-03-07T09:00:00Z",
    "distance": "18 miles",
    "opportunity_type": "Volunteer Opportunity",
    "opportunity_url": "https://volunteer.laworks.com/opportunity/a0CQg0000B3uLwuMQE",
    "opportunity_id": "a0CQg0000B3uLwuMQE",
    "organization_url": "https://volunteer.laworks.com/organization/001A000000qjVDoIAM",
    "scraped_at": "2026-02-11T17:58:26.602824"
  },
  {
    "title": "Palisades Resource Fair to Help Fire-Impacted Individuals",
    "organization": "L.A. Works - Disaster Recovery",
    "location": "Los Angeles, CA 90272",
    "date": "4/10/26",
    "time": "12:00 PM",
    "duration": "3 hours",
    "datetime_iso": "2026-04-10T12:00:00Z",
    "distance": "18 miles",
    "opportunity_type": "Special Event",
    "opportunity_url": "https://volunteer.laworks.com/opportunity/a0CQg00009J319hMAB",
    "opportunity_id": "a0CQg00009J319hMAB",
    "organization_url": "https://volunteer.laworks.com/organization/001Qg00000QgVmrIAF",
    "scraped_at": "2026-02-11T17:58:26.617985"
  },
  {
    "title": "PTSD Mental Health Program for Disaster Survivors",
    "organization": "National Emergency Child Care Network",
    "location": "Los Angeles, CA 90001",
    "date": "Ongoing",
    "time": null,
    "duration": null,
    "datetime_iso": "2025-11-11T00:01:00Z",
    "distance": "19 miles",
    "opportunity_type": "Special Event",
    "opportunity_url": "https://volunteer.laworks.com/opportunity/a0CQg00009eJkyQMAS",
    "opportunity_id": "a0CQg00009eJkyQMAS",
    "organization_url": "https://volunteer.laworks.com/organization/001Qg00000Nf5JWIAZ",
    "scraped_at": "2026-02-11T17:58:26.631316"
  },
  {
    "title": "Urban Farm Workday at S.O.W Collective's Reseda Garden",
    "organization": "Shift Our Ways Collective",
    "location": "Los Angeles, CA 91335",
    "date": "2/12/26",
    "time": "2:00 PM",
    "duration": "3 hours",
    "datetime_iso": "2026-02-12T14:00:00Z",
    "distance": "20 miles",
    "opportunity_type": "Volunteer Opportunity",
    "opportunity_url": "https://volunteer.laworks.com/opportunity/a0CQg00009OrXRsMAN",
    "opportunity_id": "a0CQg00009OrXRsMAN",
    "organization_url": "https://volunteer.laworks.com/organization/001Qg00000FJKIZIA5",
    "scraped_at": "2026-02-11T17:58:26.646412"
  },
  {
    "title": "Fight Hunger & Food Waste at the Torrance Farmers Market on Tuesdays!",
    "organization": "Food Forward",
    "location": "Torrance, CA 90501",
    "date": "Ongoing",
    "time": null,
    "duration": null,
    "datetime_iso": "2022-03-30T00:01:00Z",
    "distance": "20 miles",
    "opportunity_type": "Volunteer Opportunity",
    "opportunity_url": "https://volunteer.laworks.com/opportunity/a0C3l00000ojWz6EAE",
    "opportunity_id": "a0C3l00000ojWz6EAE",
    "organization_url": "https://volunteer.laworks.com/organization/001A000000ixpvaIAA",
    "scraped_at": "2026-02-11T17:58:26.661302"
  },
  {
    "title": "Fight Food Waste at the Torrance Farmers Market on Saturdays!",
    "organization": "Food Forward",
    "location": "Torrance, CA 90501",
    "date": "Ongoing",
    "time": null,
    "duration": null,
    "datetime_iso": "2024-02-23T00:01:00Z",
    "distance": "20 miles",
    "opportunity_type": "Volunteer Opportunity",
    "opportunity_url": "https://volunteer.laworks.com/opportunity/a0CQg00001OgmIcMAJ",
    "opportunity_id": "a0CQg00001OgmIcMAJ",
    "organization_url": "https://volunteer.laworks.com/organization/001A000000ixpvaIAA",
    "scraped_at": "2026-02-11T17:58:26.674150"
  },
  {
    "title": "Parent Committee Volunteer",
    "organization": "5-Eleven Hoops",
    "location": "Long Beach, CA 90807",
    "date": "Ongoing",
    "time": null,
    "duration": null,
    "datetime_iso": "2026-01-28T00:01:00Z",
    "distance": "21 miles",
    "opportunity_type": "Volunteer Opportunity",
    "opportunity_url": "https://volunteer.laworks.com/opportunity/a0CQg0000Avi6v1MQA",
    "opportunity_id": "a0CQg0000Avi6v1MQA",
    "organization_url": "https://volunteer.laworks.com/organization/0013l00002MQHwlAAH",
    "scraped_at": "2026-02-11T17:58:26.687520"
  },
  {
    "title": "Content Creator (Volunteer)",
    "organization": "5-Eleven Hoops",
    "location": "Long Beach, CA 90807",
    "date": "Ongoing",
    "time": null,
    "duration": null,
    "datetime_iso": "2026-01-28T00:01:00Z",
    "distance": "21 miles",
    "opportunity_type": "Volunteer Opportunity",
    "opportunity_url": "https://volunteer.laworks.com/opportunity/a0CQg0000Avhp6ZMQQ",
    "opportunity_id": "a0CQg0000Avhp6ZMQQ",
    "organization_url": "https://volunteer.laworks.com/organization/0013l00002MQHwlAAH",
    "scraped_at": "2026-02-11T17:58:26.700742"
  },
  {
    "title": "Assistant Adult Basketball Coach in Long Beach",
    "organization": "5-Eleven Hoops",
    "location": "Long Beach, CA 90807",
    "date": "2/17/26",
    "time": "1:30 PM",
    "duration": "2 hours",
    "datetime_iso": "2026-02-17T13:30:00Z",
    "distance": "21 miles",
    "opportunity_type": "Volunteer Opportunity",
    "opportunity_url": "https://volunteer.laworks.com/opportunity/a0CQg0000AaG6PiMQK",
    "opportunity_id": "a0CQg0000AaG6PiMQK",
    "organization_url": "https://volunteer.laworks.com/organization/0013l00002MQHwlAAH",
    "scraped_at": "2026-02-11T17:58:26.715969"
  },
  {
    "title": "Youth Basketball Evening Program Volunteer â€“ Long Beach",
    "organization": "5-Eleven Hoops",
    "location": "Long Beach, CA 90807",
    "date": "2/17/26",
    "time": "5:00 PM",
    "duration": "2 hours",
    "datetime_iso": "2026-02-17T17:00:00Z",
    "distance": "21 miles",
    "opportunity_type": "Volunteer Opportunity",
    "opportunity_url": "https://volunteer.laworks.com/opportunity/a0CQg0000Amsq5wMQA",
    "opportunity_id": "a0CQg0000Amsq5wMQA",
    "organization_url": "https://volunteer.laworks.com/organization/0013l00002MQHwlAAH",
    "scraped_at": "2026-02-11T17:58:26.731708"
  },
  {
    "title": "Adult Pickleball Volunteer â€“ Wednesday Afternoons",
    "organization": "5-Eleven Hoops",
    "location": "Long Beach, CA 90807",
    "date": "2/18/26",
    "time": "1:30 PM",
    "duration": "2 hours",
    "datetime_iso": "2026-02-18T13:30:00Z",
    "distance": "21 miles",
    "opportunity_type": "Volunteer Opportunity",
    "opportunity_url": "https://volunteer.laworks.com/opportunity/a0CQg0000AaGBHFMQ4",
    "opportunity_id": "a0CQg0000AaGBHFMQ4",
    "organization_url": "https://volunteer.laworks.com/organization/0013l00002MQHwlAAH",
    "scraped_at": "2026-02-11T17:58:26.747058"
  },
  {
    "title": "Tutor Underserved Children \"Help a Child Learn\"",
    "organization": "Joseph Learning Lab",
    "location": "Long Beach, CA 90755",
    "date": "Ongoing",
    "time": null,
    "duration": null,
    "datetime_iso": "2025-10-01T00:01:00Z",
    "distance": "21 miles",
    "opportunity_type": "Volunteer Opportunity",
    "opportunity_url": "https://volunteer.laworks.com/opportunity/a0CQg00008nVwBdMAK",
    "opportunity_id": "a0CQg00008nVwBdMAK",
    "organization_url": "https://volunteer.laworks.com/organization/001A000001SN7LzIAL",
    "scraped_at": "2026-02-11T17:58:26.761875"
  },
  {
    "title": "American Red Cross - Disaster Duty Officer - Long Beach and South Bay",
    "organization": "American Red Cross Los Angeles Region",
    "location": "Long Beach, CA 90806",
    "date": "Ongoing",
    "time": null,
    "duration": null,
    "datetime_iso": "2024-01-24T00:01:00Z",
    "distance": "21 miles",
    "opportunity_type": "Volunteer Opportunity",
    "opportunity_url": "https://volunteer.laworks.com/opportunity/a0CQg000016zymeMAA",
    "opportunity_id": "a0CQg000016zymeMAA",
    "organization_url": "https://volunteer.laworks.com/organization/001A000000a9b0aIAA",
    "scraped_at": "2026-02-11T17:58:26.775129"
  },
  {
    "title": "Christys Foundation Food Relief Program",
    "organization": "Christys Foundation",
    "location": "Los Angeles, CA 91324",
    "date": "2/12/26",
    "time": "10:00 AM",
    "duration": "4 hours",
    "datetime_iso": "2026-02-12T10:00:00Z",
    "distance": "21 miles",
    "opportunity_type": "Special Event",
    "opportunity_url": "https://volunteer.laworks.com/opportunity/a0CQg00009JpvKXMAZ",
    "opportunity_id": "a0CQg00009JpvKXMAZ",
    "organization_url": "https://volunteer.laworks.com/organization/001Qg00000O1wc2IAB",
    "scraped_at": "2026-02-11T17:58:26.791584"
  },
  {
    "title": "Red Cross: Local Disaster Response Volunteer - Long Beach and South Bay",
    "organization": "American Red Cross Los Angeles Region",
    "location": "Long Beach, CA 90806",
    "date": "Ongoing",
    "time": null,
    "duration": null,
    "datetime_iso": "2024-01-24T00:01:00Z",
    "distance": "21 miles",
    "opportunity_type": "Volunteer Opportunity",
    "opportunity_url": "https://volunteer.laworks.com/opportunity/a0CQg000019MR3hMAG",
    "opportunity_id": "a0CQg000019MR3hMAG",
    "organization_url": "https://volunteer.laworks.com/organization/001A000000a9b0aIAA",
    "scraped_at": "2026-02-11T17:58:26.805357"
  },
  {
    "title": "Make Cards for Senior Citizens - Easy and Fun Kids or Adults - Joy Card Project",
    "organization": "Joy Card Project - Make Cards for Seniors",
    "location": "Joy Card Project - Make Cards for Seniors (Virtual)",
    "date": "Ongoing",
    "time": null,
    "duration": null,
    "datetime_iso": "2024-12-19T00:01:00Z",
    "distance": "0 miles",
    "opportunity_type": "Special Event",
    "opportunity_url": "https://volunteer.laworks.com/opportunity/a0CQg00004k0t8PMAQ",
    "opportunity_id": "a0CQg00004k0t8PMAQ",
    "organization_url": "https://volunteer.laworks.com/organization/001Qg00000MbO8LIAV",
    "scraped_at": "2026-02-11T17:58:26.818398"
  },
  {
    "title": "Blood Drive Volunteer (No Blood Drawing) - Pomona",
    "organization": "American Red Cross Los Angeles Region",
    "location": "Pomona, CA 91768",
    "date": "Ongoing",
    "time": null,
    "duration": null,
    "datetime_iso": "2022-12-14T00:01:00Z",
    "distance": "24 miles",
    "opportunity_type": "Volunteer Opportunity",
    "opportunity_url": "https://volunteer.laworks.com/opportunity/a0C3l00000r6VjfEAE",
    "opportunity_id": "a0C3l00000r6VjfEAE",
    "organization_url": "https://volunteer.laworks.com/organization/001A000000a9b0aIAA",
    "scraped_at": "2026-02-11T17:58:26.837519"
  },
  {
    "title": "Personal Shopper: Assist Clients in Selecting Items from Women's Center",
    "organization": "Thaddeus Resource Center",
    "location": "La Verne, CA 91750",
    "date": "Ongoing",
    "time": null,
    "duration": null,
    "datetime_iso": "2024-11-18T00:01:00Z",
    "distance": "25 miles",
    "opportunity_type": "Volunteer Opportunity",
    "opportunity_url": "https://volunteer.laworks.com/opportunity/a0CQg00004IaY51MAF",
    "opportunity_id": "a0CQg00004IaY51MAF",
    "organization_url": "https://volunteer.laworks.com/organization/001Qg000003lvdqIAA",
    "scraped_at": "2026-02-11T17:58:26.852234"
  },
  {
    "title": "Fight Food Waste at the Calabasas Farmers Market on Saturdays!",
    "organization": "Food Forward",
    "location": "Woodland Hills, CA 91302",
    "date": "Ongoing",
    "time": null,
    "duration": null,
    "datetime_iso": "2023-07-01T00:01:00Z",
    "distance": "26 miles",
    "opportunity_type": "Volunteer Opportunity",
    "opportunity_url": "https://volunteer.laworks.com/opportunity/a0C3l00000u6HkyEAE",
    "opportunity_id": "a0C3l00000u6HkyEAE",
    "organization_url": "https://volunteer.laworks.com/organization/001A000000ixpvaIAA",
    "scraped_at": "2026-02-11T17:58:26.865674"
  },
  {
    "title": "Rooted in Earth. A Soil Day at Lopez Urban Farm ðŸŒ±ðŸŒ³ðŸ’§ðŸ‘©â€ðŸŒ¾ðŸŽ¬",
    "organization": "Breathe Southern California (Breathe SoCal)",
    "location": "Pomona, CA 91766",
    "date": "2/28/26",
    "time": "8:30 AM",
    "duration": "4 hours",
    "datetime_iso": "2026-02-28T08:30:00Z",
    "distance": "27 miles",
    "opportunity_type": "Volunteer Opportunity",
    "opportunity_url": "https://volunteer.laworks.com/opportunity/a0CQg0000Ag7iNbMQI",
    "opportunity_id": "a0CQg0000Ag7iNbMQI",
    "organization_url": "https://volunteer.laworks.com/organization/001A000000a9akSIAQ",
    "scraped_at": "2026-02-11T17:58:26.894235"
  },
  {
    "title": "Restore Vital San Pedro Plant Habitat",
    "organization": "Palos Verdes Peninsula Land Conservancy",
    "location": "Los Angeles, CA 90731",
    "date": "2/22/26",
    "time": "9:00 AM",
    "duration": "3 hours",
    "datetime_iso": "2026-02-22T09:00:00Z",
    "distance": "28 miles",
    "opportunity_type": "Volunteer Opportunity",
    "opportunity_url": "https://volunteer.laworks.com/opportunity/a0CQg0000AYMJZfMQP",
    "opportunity_id": "a0CQg0000AYMJZfMQP",
    "organization_url": "https://volunteer.laworks.com/organization/001A000001FA9kmIAD",
    "scraped_at": "2026-02-11T17:58:26.910108"
  },
  {
    "title": "Elementary Art Facilitator Intern: Jan-May 2026",
    "organization": "Million Little",
    "location": "Santa Clarita, CA 91355",
    "date": "2/18/26",
    "time": "9:00 AM",
    "duration": "7 hours",
    "datetime_iso": "2026-02-18T09:00:00Z",
    "distance": "30 miles",
    "opportunity_type": "Volunteer Opportunity",
    "opportunity_url": "https://volunteer.laworks.com/opportunity/a0CQg00009O3pdAMAR",
    "opportunity_id": "a0CQg00009O3pdAMAR",
    "organization_url": "https://volunteer.laworks.com/organization/001Qg00000WLpt7IAD",
    "scraped_at": "2026-02-11T17:58:26.926347"
  },
  {
    "title": "Support Red Cross Mobile Blood Drives - Volunteer! (Little Rock, CA)",
    "organization": "American Red Cross Los Angeles Region",
